Titulo;Formato;Edicion;discos;Director;Year;Genero;Observaciones;Localizacion
Your Name;Blu-Ray;Digipack Coleccionista;3;Makoto Shinkai;2016;Animación. Drama. Romance. Fantástico;Selecta Visión. CoMix Wave Films. Nueva edición con nueva portada;
El corredor del laberinto;Blu-Ray;Pack Steelbook;1;Wes Ball;2014;Ciencia ficción. Acción. Aventuras | Futuro postapocalíptico.;Pack Blu-Ray SteelBook con la trilogía. Caja con pegatinas (Caja metalica negra). 20th Century Fox, Gotham Group.;
El corredor del laberinto: Las pruebas;Blu-Ray;Pack Steelbook;1;Wes Ball;2015;Acción. Ciencia ficción | Secuela. Futuro postapocalíptico.;Pack Blu-Ray SteelBook con la trilogía. Caja con pegatinas (Caja metalica negra). 20th Century Fox, Gotham Group, TSG Entertainment, Temple Hill.;
El corredor del laberinto: La cura mortal;Blu-Ray;Pack Steelbook;1;Wes Ball;2018;Ciencia ficción. Acción | Futuro postapocalíptico. Supervivencia.;Pack Blu-Ray SteelBook con la trilogía. Caja con pegatinas (Caja metalica negra). Gotham Group, Temple Hill, 20th Century Fox.;
WALL·E;Blu-Ray;Sencilla;2;Andrew Stanton;2008;Animación. Ciencia ficción. Romance. Infantil | Robots.;Walt Disney Pictures, Pixar Animation Studios. Incluye BR de extras. Nacionalidad USA. Incluye audio catalán;
Jack Reacher: Nunca vuelvas atrás;Blu-Ray;Sencilla;1;Edward Zwick;2016;Acción. Thriller | Crimen. Secuela;"Coproducción Estados Unidos-China; Paramount Pictures, Skydance Productions";
Loving Vincent;Blu-Ray/DVD + CD;Coleccionista;3;Dorota Kobiela, Hugh Welchman;2017;Animación. Drama | Biográfico. Pintura;"Karma films. Coproducción Polonia-Reino Unido-Estados Unidos; BreakThru Films. Incluye BSO y postales. Audio catalán";
Amores Perros;Blu-Ray;Coleccionista;3;Alejandro González Iñárritu;2000;Drama | Historias cruzadas. Drama social;Selecta Visión. Altavista Films, Zeta Film;
Trigun: Badlands Rumble;Blu-Ray/DVD;Sencilla;2;Satoshi Nishimura;2010;Animación. Aventuras | Manga. Western futurista;Selecta Visión. Madhouse. Distribuido por Sony. Edición combo BR + DVD;
My Hero Academia: Dos héroes;Blu-Ray/DVD + DVD;Coleccionista;3;Kenji Nagasaki;2018;Animación. Acción. Aventuras. Comedia | Superhéroes. Manga;Selecta Visión. BONES. Incluye pelicula en BR y DVD y DVD de extras. Libreto de 36 paginas;
Psycho-Pass SS: Case.1 Crime and Punishment;Blu-Ray;Sencilla con funda cartón;1;Naoyoshi Shiotani;2019;Animación. Ciencia ficción | Cyberpunk;Selecta Visión. Production I.G. Psycho-Pass: Sinners of the System. Caso. 1 Crimen y Castigo. Slip-case. Trilogía de nuevas peliculas en 2BD y libro de 48 paginas;
Psycho-Pass SS: Case.2 First Guardian;Blu-Ray;Sencilla con funda cartón;1;Naoyoshi Shiotani;2019;Animación. Ciencia ficción | Cyberpunk;Selecta Visión. Production I.G. Psycho-Pass: Sinners of the System. Caso. 2 Primer guardián. Slip-case. Trilogía de nuevas peliculas en 2BD y libro de 48 paginas;
Psycho-Pass SS: Case.3 On the Other Side of Love and Hate;Blu-Ray;Sencilla con funda cartón;1;Naoyoshi Shiotani;2019;Animación. Ciencia ficción | Cyberpunk;Selecta Visión. Production I.G. Psycho-Pass: Sinners of the System. Caso. 3 Más allá del Bien y del Mal. Slip-case. Trilogía de nuevas peliculas en 2BD y libro de 48 paginas;
El amor está en el agua;Blu-Ray/DVD;Digipack Coleccionista;2;Masaaki Yuasa;2019;Animación. Comedia. Romance. Fantástico. Drama;Selecta Visión. Science SARU, Fuji TV, KDDI Corporation, Shogakukan-Shueisha Productions, Toho. Incluye libreto de 32 pags y pegatinas;
Aves de presa (y la fantabulosa emancipación de Harley Quinn);Blu-Ray;Steelbook;1;Cathy Yan;2020;Acción. Aventuras | Crimen. Cómic. DC Comics;DC Entertainment, Clubhouse Pictures, Kroll & Co. Entertainment, LuckyChap Entertainment. Distribuida por Warner Bros.;
Inuyasha, la película: La batalla a través del tiempo;DVD;Sencilla;1;Toshiya Shinohara;2001;Animación. Aventuras | Manga;Selecta Visión. Sunrise, Inc. 20th Century Fox. Incluye audio catalán;
Inuyasha, la película 2: El Castillo de los Sueños en el Interior del Espejo;DVD;Sencilla;1;Toshiya Shinohara;2002;Animación. Aventuras | Manga;Selecta Visión. Shogakukan-Shueisha Productions, Sunrise, Inc., Yomiuri TV. 20th Century Fox. Incluye audio catalán;
Inuyasha, la película 3: La Espada Conquistadora;DVD;Sencilla;1;Toshiya Shinohara;2003;Animación. Aventuras | Manga;Selecta Visión. Kyoto Animation, Sunrise, Inc. 20th Century Fox.;
Inuyasha, la película 4: Fuego en la Isla Mística;DVD;Sencilla;1;Toshiya Shinohara;2004;Animación. Aventuras | Manga;Selecta Visión. Kyoto Animation, Shogakukan-Shueisha Productions, Sunrise, Inc. 20th Century Fox.;
Stalingrado;Blu-Ray;Sencilla;1;Joseph Vilsmaier;1993;Bélico. Drama | II Guerra Mundial. Cine épico;a contracorriente films. Coproducción Alemania-Suecia. Global Screen.;Caja 2, debajo cama (2)
El caso de Hana y Alice;Blu-Ray;Digipack;1;Shunji Iwai;2015;Animación. Comedia. Intriga | Adolescencia. Precuela;M3 (Mediatres estudio). Winds of Asia. Rockwell Eyes Inc. Nippon TV. Digipack con las dos peliculas en BR. Incluye libreto y audio catalán;
Hana & Alice;Blu-Ray;Digipack;1;Shunji Iwai;2004;Drama. Romance | Amistad. Adolescencia;M3 (Mediatres estudio). Winds of Asia. Rockwell Eyes Inc. Digipack con las dos peliculas en BR. Incluye libreto y audio catalán;
La serpiente blanca;Blu-Ray;Sencilla;1;Amp Wong, Zhao Ji Ping;2019;Animación. Fantástico. Romance | Wuxia. Remake;"Selecta Visión. Coproducción China-Estados Unidos; Light Chaser Animation, Warner Brothers. Incluye audio catalán";
Pesadilla antes de Navidad;Blu-Ray;Coleccionista;1;Henry Selick;1993;Animación. Fantástico. Musical. Romance. Terror;Distribuida por Walt Disney Studios. Nacionalidad USA. Touchstone Pictures, Skellington Productions. Productor: Tim Burton;
Gintama;Blu-Ray;Amaray Rojo;1;Yûichi Fukuda;2017;Acción. Fantástico. Aventuras. Comedia. Manga. Live-Action;M3 (Mediatres estudio). Winds of Asia. Divisa home video. Plus D, Warner Bros. Pictures. Audio catalán;
Terraformars;Blu-Ray;Sencilla;1;Takashi Miike;2016;Ciencia ficción. Acción | Cyberpunk. Manga. Live-Action;M3 (Mediatres estudio). Winds of Asia. Warner Bros. Pictures. Incluye libreto. Slip-Cover. Amaray Negro;
Inuyashiki;Blu-Ray;Amaray Blanco;1;Shinsuke Sato;2018;Acción. Ciencia ficción | Live-Action;M3 (Mediatres estudio). Winds of Asia. Pony Canyon.  Divisa home video. Incluye libreto y audio catalán;
La matanza de Texas;Blu-Ray;Digipack;2;Tobe Hooper;1974;Terror | Slasher. Asesinos en serie. Película de culto;a contracorriente films. Bryanston Picture. Productor: Tobe Hooper. Incluye BR de extras. Audio en mono;
Roma;Blu-Ray;Digipack;1;Alfonso Cuarón;2018;Drama | Drama social. Años 70. Familia;a contracorriente films. Coproducción México-Estados Unidos. Netflix. Participant. The Criterion Collection. Incluye libro de 108 paginas;
Ghostland;Blu-Ray;Steelbook;1;Pascal Laugier;2018;Terror | Asesinos en serie. Slasher;"a contracorriente films. Coproducción Canadá-Francia; 5656 Films, Logical Pictures, Mars Films,";
Macbeth;Blu-Ray/DVD;Steelbook;2;Justin Kurzel;2015;Drama | Edad Media;a contracorriente films. Studiocanal. See-Saw Films, DMC Film, Film 4. Incluye 4 postales. Audio catalán;
Que noche la de aquel día;Blu-Ray;Especial;2;Richard Lester;1964;Comedia. Musical | Música;a contracorriente films. United Artists. Película-documental sobre los Beatles. Incluye BR de extras. Slip-Cover;
Cinema Paradiso;Blu-Ray;Digipack;2;Giuseppe Tornatore;1988;Drama. Comedia | Melodrama. Cine dentro del cine;"a contracorriente films. Coproducción Italia-Francia; Les Films Ariane, Cristaldifilm";
Doraemon The Hero: Pioneros del espacio;DVD;Sencilla;2;Shigeo Koshi;2009;Animación. Fantástico. Aventuras. Ciencia ficción;LUK INTERNATIONAL. Distribuida por Sony. Audio Catalán. Incluye corto El día que nací (El día de mi nacimiento) 2002, basado en un capitulo original de la serie.;
Doraemon: La leyenda de las sirenas;DVD;Sencilla;1;Kôzô Kusuba;2010;Animación. Fantástico. Aventuras. Comedia. Infantil ;"LUK INTERNATIONAL. Distribuida por Sony. Audio Catalán. Incluye corto ""Dorami y Los Doraemons en el Parque de Atracciones Galáctico""";
Doraemon y la revolución de los robots;DVD;Sencilla;1;Yukiyo Teramoto;2011;Animación. Ciencia ficción. Aventuras | Aventura espacial.;LUK INTERNATIONAL. Distribuida por Sony. Audio Catalán.;
Shin Chan: La invasión;DVD;Sencilla;1;Mitsuru Hongo;1993;Animación. Comedia. Fantástico | Manga;LUK INTERNATIONAL. Distribuida comercialmente por Walt Disney. TV Asahi. Audio Catalán. Incluye libreto.;
Shin Chan en la Isla del Tesoro;DVD;Sencilla;1;Tsutomu Mizushima, Keiichi Hara;1994;Animación. Infantil | Manga;LUK INTERNATIONAL. Distribuida comercialmente por Walt Disney. Incluye corto El nacimiento de Himawari. Audio Catalán. Incluye libreto.;
Shin Chan: Aventuras en Henderland;DVD;Sencilla;1;Mitsuru Hongo;1996;Animación. Comedia. Infantil | Manga;LUK INTERNATIONAL. Distribuida comercialmente por Buena Vista Home. Audio Catalán. Incluye libreto. Incluye corto Detective Nohara;
Shin chan en busca de las bolas perdidas;DVD;Sencilla;1;Keiichi Hara;1997;Animación. Comedia. Infantil | Manga;LUK INTERNATIONAL. Distribuida Sony Pictures. TV Asahi. Audio Catalán. Incluye libreto. Incluye entrevistas. Nueva portada;
Shin Chan Spa Wars: La guerra de los balnearios;DVD;Especial;2;Keiichi Hara;1999;Animación. Comedia | Manga;LUK INTERNATIONAL. Distribuida comercialmente por Walt Disney. Incluye corto Ey, que juego a ser taxista. Audio Catalán. Incluye póster, 4 postales, 1 llavero y DVD de extras;
Shin Chan: ¡Los adultos contraatacan!;DVD;Sencilla;2;Keiichi Hara;2001;Animación | Manga;LUK INTERNATIONAL. Distribuida comercialmente por Buena Vista Home. TV Asahi. Audio Catalán. Incluye libreto. Incluye corto las aventuras del cerdito valiente. Slip-Cover;
Shin Chan: El pequeño samurái;DVD;Sencilla;1;Keiichi Hara;2002;Animación. Aventuras. Infantil | Japón feudal. Siglo XVI.;LUK INTERNATIONAL. Distribuida comercialmente por Walt Disney. Incluye especial Star Chan y entrevistas. Audio Catalán.;
La Zona Muerta;Blu-Ray/DVD + DVD;Coleccionista;3;David Cronenberg;1983;Intriga. Ciencia ficción | Asesinos en serie. Política.;Selecta Visión. Dino de Laurentiis Cinematographica, Lorimar (Distribuidora: Paramount Pictures);
El regreso de los muertos vivientes 3 (Mortal Zombie);Blu-Ray/DVD + Blu-Ray;Coleccionista;3;Brian Yuzna;1993;Terror. Romance. Ciencia ficción. Comedia,;Selecta Visión. Bandai Visual, Ozla Productions;
Las colinas tienen ojos;Blu-Ray;Digipack;1;Wes Craven;1977;Terror | Supervivencia. Serie B. Película de culto;Blood Relations Co. Ref. TS494;
Las colinas tienen ojos 2;Blu-Ray;Digipack;1;Wes Craven;1985;Terror | Secuela;"Co-production Estados Unidos-Reino Unido; VTC. Ref. TS494";
Experimento Mind Ripper;Blu-Ray;Digipack;1;Joe Gayton;1995;Terror. Ciencia ficción;Multicom Entertainment Group, La Kushner-Locke Company, Outpost Productions (Productor: Wes Craven). Ref. TS494;
Nuestros maravillosos aliados;Blu-Ray;Sencilla;1;Matthew Robbins;1987;Fantástico. Ciencia ficción. Comedia | Extraterrestres;Reel One. Amblin Entertainment. Slip-cover. Incluye Libreto;
Los gemelos golpean dos veces;Blu-Ray;Sencilla;1;Ivan Reitman;1988;Comedia | Familia. Cine familiar;Reel One. Universal Pictures. Slip-cover. Incluye Libreto;
Huida a medianoche;Blu-Ray;Sencilla;1;Martin Brest;1988;Acción. Comedia | Road Movie. Mafia.;Reel One. City Light Films (Distribuidora: Universal Pictures). Slip-cover. Incluye Libreto;
Acción mutante;Blu-Ray;Sencilla;1;Álex de la Iglesia;1993;Ciencia ficción. Comedia. Acción | Terrorismo.;Cameo. El Deseo. Slip-cover;
Kong: La isla calavera;Blu-Ray;Sencilla;1;Jordan Vogt-Roberts;2017;Aventuras. Fantástico. Acción | Monstruos. Simios;Legendary Pictures, Tencent Pictures, Warner Bros. Slip-cover;
Godzilla;Blu-Ray;Sencilla;1;Gareth Edwards;2014;Ciencia ficción. Acción. Drama | Monstruos. 3-D;Legendary Pictures, Warner Bros. Slip-cover;
El mago de Oz;Blu-Ray;Sencilla;1;Victor Fleming;1939;Fantástico. Musical. Aventuras | Cine familiar.;Metro-Goldwyn-Mayer (MGM) (Productor: Mervyn LeRoy). Slip-cover;
Mañana;Blu-Ray;Sencilla;1;Cyril Dion, Mélanie Laurent;2015;Documental | Fin del mundo;Karma Films. Move Movie, Mars Films, Mely Productions. Slip-cover. KA73833;
Trono de sangre;Blu-Ray;Amaray Negro;1;Akira Kurosawa;1957;Drama | Japón feudal. Siglo XVI. Samuráis;a contracorriente films. Toho, Kurosawa Production Co. Slip-cover. AC0305;
Vivir (Ikiru);Blu-Ray;Amaray Negro;1;Akira Kurosawa;1952;Drama | Enfermedad. Vejez/Madurez. Drama psicológico. ;a contracorriente films. Toho. Slip-cover;
Dersu Uzala (El cazador);Blu-Ray;Amaray Negro;1;Akira Kurosawa;1975;Aventuras. Drama | Años 1900 (circa). Amistad.;a contracorriente films. Co-production Unión Soviética (URSS)-Japón. Slip-cover;
Venganza bajo cero;Blu-Ray;Sencilla;1;Hans Petter Moland;2019;Thriller. Acción. Comedia | Venganza;"a contracorriente. Co-production Reino Unido-Noruega-Estados Unidos-Canadá-Francia; Studiocanal. Slip-Cover";
Día de lluvia en Nueva York;Blu-Ray;Sencilla;1;Woody Allen;2019;Romance. Comedia | Comedia romántica;a contracorriente. Gravier Productions, Perdido Productions. Slip-Cover;
Handia;Blu-Ray;Sencilla;1;Jon Garaño, Aitor Arregi;2017;Drama | Basado en hechos reales. Siglo XIX;a contracorriente. Irusoin, Kowalski Films, Moriarti Produkzioak. Slip-Cover;
La decisión del rey;Blu-Ray;Amaray Negro;1;Erik Poppe;2016;Bélico | II Guerra Mundial. Histórico;a contracorriente. Film I Väst, Newgrange Pictures. Paradox Spillefilm. AC0661;Caja 2, debajo cama (2)
Nieve negra;Blu-Ray;Amaray Negro;1;Martín Hodara;2017;Drama. Intriga. Thriller | Familia.;a contracorriente. Co-production Argentina-España. AC0632;Caja 2, debajo cama (2)
OSS 117: Perdido en Río;Blu-Ray;Amaray Naranja;1;Michel Hazanavicius;2009;Comedia. Acción | Espionaje. Años 60. Nazismo.;a contracorriente. Mandarin Production, Gaumont. AC0849;Caja 2, debajo cama (2)
Mamá y papá;Blu-Ray;Amaray Rojo;1;Brian Taylor;2017;Comedia. Terror. Thriller | Comedia de terror.;a contracorriente. Armory Films, Three Point Capital, Zeal Media. Nicolas Cage. AC0771;
El fantasma de la libertad;Blu-Ray;Amaray Rosa;1;Luis Buñuel;1974;Drama. Comedia | Surrealismo.;"a contracorriente. Co-production Francia-Italia; Eurointer. AC0630";Caja 2, debajo cama (2)
Maravillosa familia de Tokio;Blu-Ray;Amaray Rosa;1;Yôji Yamada;2016;Comedia. Drama | Familia;a contracorriente. Shôchiku. AC0636;Caja 2, debajo cama (2)
Su mejor historia;Blu-Ray;Amaray Lila;1;Lone Scherfig;2016;Romance. Comedia | II Guerra Mundial. Años 40.;a contracorriente. BBC Films, Number 9 Films. AC0654;Caja 2, debajo cama (2)
La música del silencio;Blu-Ray;Amaray Lila;1;Michael Radford;2017;Drama | Biográfico. Música. Discapacidad;a contracorriente. Picomedia. AC0769;Caja 2, debajo cama (2)
Borning: Más rápido, más peligroso;Blu-Ray;Sencilla;1;Hallvard Braein;2016;Acción. Comedia | Coches/Automovilismo. Secuela;a contracorriente. Filmkameratene A/S. Noruega. AC0621;Caja 2, debajo cama (2)
Borg McEnroe. La película;Blu-Ray;Sencilla;1;Janus Metz Pedersen;2017;Drama | Basado en hechos reales. Deporte. Tenis.;a contracorriente. Co-production Suecia-Dinamarca-Finlandia. AC0746;Caja 2, debajo cama (2)
El pico;Blu-Ray;Sencilla;1;Eloy de la Iglesia;1983;Drama | Drogas. Adolescencia. Cine quinqui.;Divisa. Ópalo Films. Mercury Films. Amaray sencillo con dos discos para las dos peliculas. Edición 2019;
El pico 2;Blu-Ray;Sencilla;1;Eloy de la Iglesia;1984;Drama | Drogas. Secuela. Cine quinqui;Divisa. Ópalo Films. Mercury Films. Amaray sencillo con dos discos para las dos peliculas. Edición 2019;
La Historia del mundo;Blu-Ray;Sencilla;2;Neil Rawles, Guy Smith, Renny Bartlett;2012;Serie de TV. Documental | Documental sobre Historia;Divisa. BBC, Discovery UK, The Open University. 2 BR con: 1. Supervivencia, 2. La edad de los imperios, 3. La palabra y la espada, 4. Hacia la luz, 5. Conquista y expolio, 6. Revolución, 7. La era industrial, 8. La edad de los extremos;
¿Quién engañó a Roger Rabbit?;Blu-Ray;Sencilla;1;Robert Zemeckis;1988;Animación. Comedia. Infantil. Aventuras | Neo-noir.;Divisa. Amblin entertainment. Touchstone Pictures. No se puede exportar ni redistribuir sin la autorización de Walt Disney Company. DVBSY;
A War (Una guerra);Blu-Ray;Sencilla;1;Tobias Lindholm;2015;Drama. Bélico | Ejército. Guerra de Afganistán. Familia;Karma Films. A BOR DAR. Nordisk Film Production, Radio (DR), Det Danske Filminstitut, Nordisk Film, Studio Canal;
El último concierto;Blu-Ray;Sencilla;1;Yaron Zilberman;2012;Drama | Música. Enfermedad. Amistad;Emon. Savor. RKO Pictures, Concept Entertainment, Unison Films. Incluye audio catalán;
George Harrison: Living in the Material World;Blu-Ray;Sencilla;1;Martin Scorsese;2011;Documental | Documental sobre música. Biográfico;Avalon. Editado y distribuido por Cameo. Grove Street Productions, Sikelia Productions, Spitfire Pictures;
La chispa de la vida;Blu-Ray;Sencilla;1;Álex de la Iglesia;2011;Drama. Comedia | Comedia dramática. Comedia negra.;Paramount. Double Nickel Entertainment, Trivisión S.L;
15:17 Tren a París;Blu-Ray;Sencilla;1;Clint Eastwood;2018;Acción. Drama | Basado en hechos reales. Terrorismo.;Distribuida en España por Twentieth Century Fox. Malpaso Productions, Village Roadshow , Warner Bros.;
The Prince;Blu-Ray;Sencilla;1;Brian A. Miller;2014;Thriller. Acción | Secuestros / Desapariciones.;Inopia Films. Distribuido por Divisa. Grindstone Entertainment Group, EFO Films, Aperture Entertainment. Incluye  audio catalán;
Bat 21;Blu-Ray;Sencilla;1;Peter Markle;1988;Bélico | Guerra de Vietnam. Basado en hechos reales;Ref. TS522. TriStar Pictures, Vision PDG;Caja 1, debajo cama (2)
Metrópolis;Blu-Ray;Digibook;2;Fritz Lang;1927;Ciencia ficción. Drama | Distopía. Steampunk.;Divisa Home Video. U.F.A. Incluye BR de extras y libro de 64 páginas. Colección origenes del cine;
Medianoche en París;Blu-Ray/DVD;Digibook;2;Woody Allen;2011;Comedia. Romance. Fantástico. Comedia romántica.;"Cameo. Co-production Estados Unidos-España-Francia; Gravier Productions, Mediapro, Pontchartrain Productions, Televisión de Galicia (TVG), Versátil Cinema Incluye audio catalán. Peli en BR y DVD";
The Skull Man;DVD;Sencilla con funda cartón;3;Takeshi Mori, Hirokazu Yamada;2007;Serie de TV. Animación. Intriga. Terror. Fantástico;Selecta Visión. Serie de TV (2007). 13 episodios. Distribuido por Sony. BONES, Geneon Entertainment Inc. Yomiko, Ishimori Entertainment Inc, Toyokasei Co. Ltd. Funda cartón con 3 DVD slims;
Fate/stay night;DVD;Digipack;3;Yuji Yamaguchi, Kousuke Kobayashi;2005;Serie de TV. Animación. Drama. Acción. Fantástico.;Savor. Anime Project. Digipack sin funda con 3 DVD con episodios del 13 al 24. Box 2;
Fate/stay night;DVD;Steelbook;2;Yuji Yamaguchi, Kousuke Kobayashi;2005;Serie de TV. Animación. Drama. Acción. Fantástico.;Savor. Anime Project. Steelbook con pegatina. 4 capitulos (21-24). Vol. 6;
Fast & Furious: Hobbs & Shaw;Blu-Ray/DVD;Steelbook;2;David Leitch;2019;Acción. Ciencia ficción | Buddy Film. Familia.;"Distribuido por Sony. Co-production Estados Unidos-Reino Unido; Universal Pictures. Incluye DVD de extras";
Excel Saga;DVD;Sencilla;1;Shinichi Watanabe, Akihiko Nishiyama;1999;Serie de TV. Animación. Comedia. Ciencia ficción;Selecta Visión. DVD Manga. Misiones 1 a 3. Edición 2004;
Millennium;Blu-Ray;Sencilla;6;Niels Arden Oplev, Daniel Alfredson;2010;Serie de TV. Thriller. Intriga. Acción ;Emon. Vértigo. Yellow Bird Films. Más de 9 horas. 6 discos en seis amarays en funda de cartón azul brillante;
Mulan;Blu-Ray;Steelbook;1;Niki Caro;2020;Aventuras. Acción. Bélico. Drama;Walt Disney Pictures, Jason T. Reed Productions, Good Fear Content (Distribuidora: Walt Disney Pictures). Cartón exterior con cajón donde guardar el SteelBook;
Stuber Express;Blu-Ray;Sencilla;1;Michael Dowse;2019;Comedia. Acción | Buddy Film;20th Century Fox;
La milla verde;Blu-Ray;Sencilla;1;Frank Darabont;1999;Drama. Fantástico | Drama carcelario. Sobrenatural.;Distribuida en España por The Walt Disney Company. Warner Bros., Castle Rock Entertainment. Amary azul reciclable;Caja 3, debajo cama (1)
Sin Rodeos;Blu-Ray;Sencilla;1;Santiago Segura;2018;Comedia | Remake;a contracorriente. Europa Distribution. Atresmedia Cine, Bowfinger, Movistar+. Slip-Cover. Tapa con imanes y ruleta.;
Steins Gate the Movie: Load Region of Déjà vu;Blu-Ray/DVD;Coleccionista;2;Kanji Wakabayashi;2013;Animación. Ciencia ficción. Thriller. Drama;Selecta Visión. AT-X, Frontier Works, Future Gadget Lab, Kadokawa Pictures, Mages. Incluye 2 libros;
Human Lost;Blu-Ray;Sencilla;1;Fuminori Kizaki;2019;Animación. Ciencia ficción. Acción | Cyberpunk;Selecta Visión. Polygon Pictures (Distribuidora: Funimation, Toho, Netflix). Incluye Audio catalán. (Le cambié el amaray azúl original por uno negro);
El curioso caso de Benjamin Button;Blu-Ray;Sencilla;2;David Fincher;2008;Fantástico. Romance. Drama | Años 80. Años 90;Distribuida por Warner Bros. Paramount Pictures, Warner Bros. The Kennedy/Marshall Company;
Mula;Blu-Ray;Sencilla;1;Clint Eastwood;2018;Drama | Familia. Vejez/Madurez. Drogas.;Imperative Entertainment, Warner Bros., Bron Studios, Malpaso Productions;Caja 3, debajo cama (1)
Philadelphia;Blu-Ray;Sencilla;1;Jonathan Demme;1993;Drama | Enfermedad. SIDA. Homosexualidad;TriStar Pictures, Clinica Estetico Productions;Caja 3, debajo cama (1)
Ran;Blu-Ray;Sencilla;2;Akira Kurosawa;1985;Drama. Bélico | Japón feudal. Siglo XVI. Familia. Cine épico;"Divisa. Studiocanal. Co-production Japón-Francia; Greenwich Film Productions. Incluye DVD de extras. Nueva restauración 4K";Caja 2, debajo cama (2)
La Librería;Blu-Ray/DVD + CD;Digipack;3;Isabel Coixet;2017;Drama | Años 50. Literatura;"a contracorriente. Co-production España-Reino Unido-Alemania; Green Films, Diagonal Televisión. Pelicula en BR y DVD. Incluye CD con la BSO y libreto de 32 págs";
The Beatles: Eight Days a Week - The Touring Years;Blu-Ray;Digipack;2;Ron Howard;2016;Documental | Documental sobre música;a contracorriente. Apple Corps, Imagine Entertainment, White Horse Pictures. Incluye libreto de 64 págs. Incluye audio catalán;
Mimosas;Blu-Ray/DVD;Digipack;2;Oliver Laxe;2016;Drama. Aventuras;Numax. Distribuido por Cameo. Zeitun Films, Rouge International. Incluye diario de rodaje (La debilidad de creer);
Sin Perdón;Blu-Ray;Sencilla;1;Clint Eastwood;1992;Western. Drama | Venganza. Vejez/Madurez;Warner Bros., Malpaso Productions;Caja 3, debajo cama (1)
Independence Day;Blu-Ray;Sencilla;2;Roland Emmerich;1996;Ciencia ficción. Acción | Extraterrestres. Fin del mundo;Distribuida por 20th Century Fox. Centropolis Entertainment. Edición 20 aniversario. Incluye BR de extras. Ed. 2016;Caja 3, debajo cama (1)
The Human Centipede (First Sequence);Blu-Ray;Coleccionista;1;Tom Six;2009;Terror | Gore. Secuestros / Desapariciones. Medicina.;Six Entertainment;
The Human Centipede 2 (Full Sequence);Blu-Ray;Coleccionista;1;Tom Six;2011;Terror | Gore. Secuestros / Desapariciones. Asesinos en serie;"Co-production Países Bajos (Holanda)-Estados Unidos-Reino Unido; Six Entertainment";
The Human Centipede 3 (Final Sequence);Blu-Ray;Coleccionista;1;Tom Six;2015;Terror | Gore. Sátira. Comedia negra. Secuela;"Co-production Países Bajos (Holanda)-Estados Unidos; Six Entertainment";
La isla de los recuerdos y el espejo mágico;DVD;Sencilla;1;Shinsuke Sato;2009;Animación. Fantástico;Selecta Visión. Production I.G, Dentsu Inc, Fuji TV;
Iczer Reborn (Iczer 3);DVD;Sencilla;1;Toshihiro Hirano;1990;Animación. Ciencia ficción. Aventuras | Manga;Selecta Visión. AIC. Serie de 6 Ovas.;
Sakura Wars;DVD;Sencilla;1;Takaaki Ishiyama;1998;Acción. Animación | Mediometraje;Selecta Visión. Animate Film, Bandai Visual, Radix, SEGA. Distribuido por Universal. Serie completa: 4 episodios. D-rights;
Legend of Lemnear;DVD;Sencilla;1;Kinji Yoshimoto;1989;Animación. Fantástico | Mediometraje. Manga;Selecta Visión. Distribuido por Universal. AIC, Soshin Pictures Enterprise. Manga video. Ed. 2005;
Project Zero: Zeorymer;DVD;Sencilla;1;Toshihiro Hirano;1988;Animación. Ciencia ficción | Miniserie de TV;Selecta Visión. ARTMIC Studios, AIC. 4 episodios. Ed. 2004;
Onward;Blu-Ray;Steelbook;2;Dan Scanlon;2020;Animación. Aventuras. Comedia. Fantástico | Magia. Familia;Pixar Animation Studios, Walt Disney Pictures (Distribuidora: Walt Disney Pictures). Incluye BR de extras. Audio catalán. Cartón exterior con cajón donde guardar el SteelBook;
Digimon Tamers (Digimon 3);DVD;Sencilla;1;Yukio Kaizawa;2001;Serie de TV. Animación. Comedia. Aventuras. Infantil;8 episodios. Arait Multimedia. Producido por Toei Animation. DVD fabricado por TMC y distribuido por Arait. 2001;
El samurái sin nombre (Sword of the Stranger);DVD;Coleccionista;2;Masahiro Andô;2007;Animación. Acción. Aventuras | Japón feudal.;Selecta Visión. Distribuido por Paramount. BONES. Slip-Cover. Incluye DVD de extras y audio catalán.;
Shin chan en busca de las bolas perdidas;DVD;Sencilla;1;Keiichi Hara;1997;Animación. Comedia. Infantil | Manga;LUK INTERNATIONAL. Distribuida por Walt Disney. TV Asahi. Audio Catalán. Incluye entrevistas. Portada original (Segunda mano);
Los sueños de Akira Kurosawa;Blu-Ray;Sencilla;1;Akira Kurosawa;1990;Fantástico. Drama | Realismo mágico. Holocausto nuclear.;"Co-production Japón-Estados Unidos; (Distribuidora: Warner Bros.)";
Rescate en Osiris;Blu-Ray;Sencilla;1;Shane Abbess;2016;Ciencia ficción. Aventuras. Acción | Aventura espacial;a contracorriente. Storm Vision Entertainment, Eclectik Vision, Storm Alley Entertainment. AC0680;
