Titulo;Formato;Edicion;discos;Director;Year;Genero;Observaciones;Localizacion
Mi vecino Totoro;Blu-Ray;Amaray Negro;1;Hayao Miyazaki;1988;Animación. Fantástico;Vertigo, Studio Ghibli. Edición sencilla;
Susurros del corazón;Blu-Ray;Amaray Negro;1;Yoshifumi Kondô;1995;Animación. Drama;Vertigo, Studio Ghibli. Edición sencilla. Guion de Hayao Miyazaki;
Paprika;Blu-Ray;Sencilla;1;Satoshi Kon;2006;Animación. Ciencia ficción;Distribuido por Sony. Madhouse. Novela: Yasutaka Tsutsui;
Assassination Classroom;Blu-Ray;Pack Amaray amarillo;1;Eiichirô Hasumi;2015;Comedia. Ciencia ficción. Manga. Live-Action;Pack con las dos pelis juntas. Incluye libreto. M3 (Mediatres estudio) Winds of Asia;
Assassination Classroom: La graduación;Blu-Ray;Pack Amaray amarillo;1;Eiichirô Hasumi;2016;Comedia. Ciencia ficción. Manga. Live-Action;Pack con las dos pelis juntas. Incluye libreto. M3 (Mediatres estudio) Winds of Asia;
Los Vengadores;Blu-Ray;Pack Cartón 4 Amaray's;1;Joss Whedon;2012;Fantástico. Acción. Ciencia ficción;Pack colección completa 4 peliculas. Los Vengadores Reunidos.;
Vengadores: La era de Ultrón;Blu-Ray;Pack Cartón 4 Amaray's;1;Joss Whedon;2015;Fantástico. Acción. Ciencia ficción;Pack colección completa 4 peliculas. Los Vengadores Reunidos.;
Vengadores: Infinity War;Blu-Ray;Pack Cartón 4 Amaray's;1;Anthony Russo, Joe Russo;2018;Ciencia ficción. Fantástico. Acción;Pack colección completa 4 peliculas. Los Vengadores Reunidos.;
Vengadores: Endgame;Blu-Ray;Pack Cartón 4 Amaray's;2;Anthony Russo, Joe Russo;2019;Ciencia ficción. Fantástico. Acción;Pack colección completa 4 peliculas. Los Vengadores Reunidos. Incluye Blu-Ray de extras.;
Celda 211;DVD;Steelbook;2;Daniel Monzón;2009;Thriller. Drama;Star MetalPack Patent Pending. DVD con la pelicula y DVD con contenidos especiales. Caracteristicas impresas en el propio metal.;
Emoji: La película;Blu-Ray;Steelbook;2;Anthony Leondis;2017;Animación. Comedia. Aventuras;Pelicula en Blu-Ray más DVD. Papel por fuera con las caracteristicas.;
Yo, Robot;Blu-Ray;Steelbook;1;Alex Proyas;2004;Ciencia ficción. Thriller;Steelbook azúl con papel por fuera con las caracteristicas;
Tres anuncios en las afueras;Blu-Ray;Steelbook;1;Martin McDonagh;2017;Thriller. Drama. Comedia;20th Century Fox. Steelbook con papel por fuera con las caracteristicas;
Creepshow;Blu-Ray;Steelbook;1;George A. Romero;1982;Terror. Comedia;FuturePak. Patent Pending. Incluye 8 postales e imán exterior. Edición númerada 0842/1000. Guion Stephen King;
Creepshow 2;Blu-Ray;Sencilla;1;Michael Gornick;1987;Terror. Fantástico. Animación;Edición sencilla Blu-Ray. Ref. 4595;Caja 1, debajo cama (2)
Terminator Génesis;Blu-Ray;Steelbook;2;Alan Taylor;2015;Ciencia ficción. Acción;Edición italiana. Contiene Blu-Ray de extras. Caja SteelBook con relieve. SkyDance. Paramount. Arnold Schwarzenegger;
Matrix;Blu-Ray;Pack Steelbook;1;Hermanas Wachowski;1999;Ciencia ficción. Fantástico. Acción;Caja metalica. La trilogía + Animatrix. Caja con pegatinas (Caja metalica negra);
Matrix Reloaded;Blu-Ray;Pack Steelbook;1;Hermanas Wachowski;2003;Ciencia ficción. Fantástico. Acción. Thriller;Caja metalica. La trilogía + Animatrix. Caja con pegatinas (Caja metalica negra);
Matrix Revolutions;Blu-Ray;Pack Steelbook;1;Hermanas Wachowski;2003;Ciencia ficción. Fantástico. Acción. Thriller;Caja metalica. La trilogía + Animatrix. Caja con pegatinas (Caja metalica negra);
Animatrix;Blu-Ray;Pack Steelbook;1;Andrew R. Jones, Shin'ichir? Watanabe;2003;Animación. Ciencia ficción. Fantástico. Acción. Drama;Caja metalica. La trilogía + Animatrix. Caja con pegatinas (Caja metalica negra);
Balto Aventura en la Tierra de Hielo;DVD;Sencilla;1;Phil Weinstein;2002;Animación. Aventuras;Universal. Edición sencilla en DVD (2020);
Basil el Ratón SuperDetective (Clásico 26);DVD;Sencilla;1;John Musker, Ron Clements;1986;Animación. Intriga. Aventuras;Edición Especial. Edición en DVD del 2017.;
MedaBots La Robobatalla Final;DVD;Sencilla;1;Tensai Okamura;1999;Serie de TV. Animación. Ciencia ficción;Tres episodios. 24, 25 y 26 (37, 38 y 39 numeración japonesa). Divisa Home Video. DivMagic;
La loca Historia de los 3 mosqueteros;DVD;Sencilla;1;Mariano Ozores;1983;Comedia | Siglo XVIII. Capa y espada;Martes y 13.  Edición sencilla en DVD. MangaFilms. Audio en mono.;
Marte (The Martian);Blu-Ray;Digibook;1;Ridley Scott;2015;Ciencia ficción. Drama;Edición con libro. 20th Century Fox.;
Interstellar;Blu-Ray;Digibook;2;Christopher Nolan;2014;Ciencia ficción. Drama. Aventuras;Edición con libro. Warner Bros. Incluye Blu-Ray de extras.;
 El hombre de acero;Blu-Ray;Pack Amaray gordo;1;Zack Snyder;2013;Ciencia ficción. Fantástico. Acción | Superhéroes;DC Colección 7 Películas en funda de cartón;
Batman v. Superman: El amanecer de la Justicia;Blu-Ray;Pack Amaray gordo;2;Zack Snyder;2016;Fantástico. Acción. Ciencia ficción | Superhéroes;DC Colección 7 Películas. Incluye versión extendida;
Escuadrón suicida;Blu-Ray;Pack Amaray gordo;1;David Ayer;2016;Thriller. Fantástico. Acción | Superhéroes. Crimen;DC Colección 7 Películas en funda de cartón;
Wonder Woman ;Blu-Ray;Pack Amaray gordo;1;Patty Jenkins;2017;Fantástico. Acción. Bélico. Aventuras | Superhéroes;DC Colección 7 Películas en funda de cartón;
 Liga de la Justicia;Blu-Ray;Pack Amaray gordo;1;Zack Snyder;2017;Acción. Fantástico | Superhéroes. Cómic.;DC Colección 7 Películas en funda de cartón;
Aquaman;Blu-Ray;Pack Amaray gordo;1;James Wan;2018;Fantástico. Acción | Superhéroes. Cómic.;DC Colección 7 Películas en funda de cartón;
¡Shazam!;Blu-Ray;Pack Amaray gordo;1;David F. Sandberg;2019;Fantástico. Comedia. Acción | Superhéroes. Magia.;DC Colección 7 Películas en funda de cartón;
Han Solo: Una historia de Star Wars;Blu-Ray 3D;Sencilla 3D;3;Ron Howard;2018;Ciencia ficción. Aventuras. Fantástico;LucasFilm Ltd. Incluye disco con la pelicula en 3D, disco con la pelicula en 2D y disco de extras.;
Rogue One: Una historia de Star Wars;Blu-Ray 3D;Sencilla 3D;3;Gareth Edwards;2016;Ciencia ficción. Acción. Bélico;LucasFilm Ltd. Incluye disco con la pelicula en 3D, disco con la pelicula en 2D y disco de extras.;
 El código Da Vinci;Blu-Ray;Pack Amaray gordo;1;Ron Howard;2006;Intriga. Thriller | Religión. Matemáticas;Pack de tres peliculas.  La Trilogía de Robert Langdon;
Ángeles y Demonios;Blu-Ray;Pack Amaray gordo;1;Ron Howard;2009;Thriller. Intriga | Religión. Secuela;Pack de tres peliculas.  La Trilogía de Robert Langdon;
Inferno;Blu-Ray;Pack Amaray gordo;1;Ron Howard;2016;Thriller. Intriga | Secuela;Pack de tres peliculas.  La Trilogía de Robert Langdon;
Iron Man;Blu-Ray;Sencilla;2;Jon Favreau;2008;Fantástico. Acción. Aventuras. Ciencia ficción;Edición apaisada. Distribuido por Sony. Marvel. Inlcuye Blu-Ray de extras. Incluye audio catalán.;
Iron Man 2;Blu-Ray;Sencilla;1;Jon Favreau;2010;Fantástico. Ciencia ficción. Acción;Distribuido por Disney.2010 Marvel. ;
Iron Man 3;Blu-Ray;Sencilla;1;Shane Black;2013;Fantástico. Ciencia ficción. Acción;Distribuido por Disney. 2013 Marvel. Paramount Pictures. Edición sencilla Blu-Ray con extras.;
Spider-man Un nuevo Universo;Blu-Ray;Sencilla;2;Persichetti, Ramsey, Rothman;2018;Animación. Aventuras. Acción;Distribuido por Sony. Marvel. Mejor pelicula de animación 2019. Incluye Blu-Ray de extras.;
Spider-man Lejos de casa;Blu-Ray;Sencilla;1;Jon Watts;2019;Fantástico. Acción. Ciencia ficción;Distribuido por Sony. Marvel. Columbia Pictures. ;
El Increíble Hulk;Blu-Ray;Sencilla;1;Louis Leterrier;2008;Fantástico. Acción. Ciencia ficción;Edición apaisada. Distribuido por Sony. Marvel. Incluye audio catalán. Edward Norton;
Hulk;Blu-Ray;Sencilla;1;Ang Lee;2003;Fantástico. Acción. Ciencia ficción. Drama;Distribuido por Universal. ;
Uno de los nuestros;Blu-Ray;Sencilla;2;Martin Scorsese;1990;Thriller. Drama | Mafia. Crimen. Años 70. Años 80;Warner Bros. Iconic Moments. Con slip cover. Incluye Blu-Ray de extras.;
Charlie y la fabrica de chocolate;Blu-Ray;Sencilla;1;Tim Burton;2005;Fantástico. Comedia. Infantil | Remake;Warner Bros. Iconic Moments. Con slip cover.;
Maggie;Blu-Ray/DVD;Combo;2;Henry Hobson;2015;Terror. Drama. Thriller | Zombis;Arnold Schwarzenegger. Combo DVD/Blu-Ray por divisa. Inopia Films.;
El Tren de las 3:10;Blu-Ray;Sencilla;1;James Mangold;2007;Western. Acción | Remake;Russell Crowe, Christian Bale. Filmax home video;
Viaje al fondo del mar;Blu-Ray;Sencilla;1;Irwin Allen;1961;Aventuras. Ciencia ficción;Edición sencilla Blu-Ray. Amary azul reciclable. Karma films. 20th Century-Fox;
La amenaza invisible Stealth;Blu-Ray;Sencilla;1;Rob Cohen;2005;Acción | Aviones. Ejército;Caja amaray azul c on cierre. Distribuido por Sony. Columbia Pictures.;
Snatch Cerdos y diamantes;Blu-Ray;Sencilla;1;Guy Ritchie;2000;Comedia | Comedia negra. Crimen. Mafia.;Distribuido por Sony. Caja Amaray azul normal. 2009 Sony Pictures Home Entertainment Inc;
Lagrimas del Sol;Blu-Ray;Sencilla;1;Antoine Fuqua;2003;Bélico. Acción | África. Ejército;Bruce Willis. Distribuido por Sony. Columbia Pictures;
Prospect;Blu-Ray;Sencilla;1;Christopher Caldwell, Zeek Earl;2018;Ciencia ficción;Selecta Visión. YouPlanet. Sitges 2018. Coproducción Estados Unidos-Canadá;Caja 2, debajo cama (2)
La pasión de Cristo;Blu-Ray/DVD;Sencilla;2;Mel Gibson;2004;Drama | Religión. Biblia. Gore;Incluye DVD de extras. Ref. 4749. Newmarket, Icon Productions;Caja 1, debajo cama (2)
Juana de Arco;Blu-Ray;Sencilla;1;Luc Besson;1999;Drama | Histórico. Biográfico. Siglo XV.;Milla Jovovich, John Malkovich. Divisa. Gaumont.;Caja 2, debajo cama (2)
Jojo's Bizarre Adventure Diamond's Unbreakable;Blu-Ray;Sencilla;1;Takashi Miike;2017;Acción. Fantástico | Manga. Live-Action;Selecta Visión. Toho. TBS. 20th Cenuty Fox;
Tokyo Ghoul;Blu-Ray;Sencilla;1;Kentarô Hagiwara;2017;Terror. Fantástico. Acción | Manga. Live-Action;Selecta Visión. Shôchiku. 20th Century Fox.;
La heroica Leyenda de Arslan;Blu-Ray;Sencilla;2;Noriyuki Abe;2015; Animación. Fantástico. Aventuras ;Jonu Media. Japan Weekend Anime. Serie de 25 episodios. Kodansha.;
Salt;Blu-Ray;Sencilla;1;Phillip Noyce;2010;Thriller. Acción | Espionaje;Angelina Jolie. Distribuido por Sony.Columbia Pictures. Edición extendida de lujo;Caja 3, debajo cama (1)
Lucy;Blu-Ray;Sencilla;1;Luc Besson;2014;Acción. Ciencia ficción. Thriller. ;Scarlett Johansson, Morgan Freeman. Universal. Europa Corp. Francia;Caja 3, debajo cama (1)
Chef;Blu-Ray;Sencilla;1;Jon Favreau;2014;Comedia | Familia. Cocina;Sony. Distribuido por Twentieth century Fox. Aldamisa Entertainment. Fetisov Teterin Films;Caja 3, debajo cama (1)
After Earth;Blu-Ray;Sencilla;1;M. Night Shyamalan;2013;Ciencia ficción. Acción. Aventuras;Jaden Smith, Will Smith. Distribuido por Sony. Columbia Pictures;Caja 3, debajo cama (1)
The Warriors Los Amos de la noche;Blu-Ray;Sencilla;1;Walter Hill;1979;Acción | Crimen. Bandas/pandillas callejeras.;Paramount Pictures. Ref. 4626;Caja 1, debajo cama (2)
Romeo + Julieta de William Shakespeare;Blu-Ray;Sencilla;1;Baz Luhrmann;1996;Romance. Drama | Drama romántico;Leonardo DiCaprio. 20th Century Fox. Bazmark Films, Estudios Churubusco;Caja 3, debajo cama (1)
El ataque de los tomates asesinos;Blu-Ray;Steelbook;1;John De Bello;1978;Comedia. Terror. Ciencia ficción. Musical;Pack con las dos pelis juntas. Caja metalica con relieve. Con carton exterior. Edición limitada 1278/1500. Gravitas Ventures. Lakeshore;
El retorno de los tomates asesinos;Blu-Ray;Steelbook;1;John De Bello;1988;Terror. Ciencia ficción. Acción | Serie B;Pack con las dos pelis juntas. Caja metalica con relieve. Con carton exterior. Edición limitada 1278/1500. Gravitas Ventures. Lakeshore;
Zombies party;Blu-Ray;Pack Amaray gordo;1;Edgar Wright;2004;Comedia. Terror. Romance | Comedia de terror.;Pack con las tres peliculas. Amaray azul (Gordo). Universal. Focus Features;
Arma fatal;Blu-Ray;Pack Amaray gordo;1;Edgar Wright;2007;Comedia. Acción | Parodia. Policíaco.;Pack con las tres peliculas. Amaray azul (Gordo). Universal. Focus Features;
Bienvenidos al fin del mundo;Blu-Ray;Pack Amaray gordo;1;Edgar Wright;2013;Comedia. Ciencia ficción | Fin del mundo.;Pack con las tres peliculas. Amaray azul (Gordo). Universal. Focus Features;
Space Jam;Blu-Ray;Sencilla;1;Joe Pytka;1996;Animación. Comedia. Ciencia ficción. Fantástico.;Michael Jordan. Edición sencilla Blu-Ray. Amary azul reciclable. Warner Bros.;
Señora Doubtfire, papá de por vida;Blu-Ray;Sencilla;1;Chris Columbus;1993;Comedia. Drama | Familia. Televisión. Cine familiar.;Robin Williams. Edición sencilla Blu-Ray. Amary azul reciclable.20th Century Fox.;
La gran aventura de Winter el delfin;Blu-Ray;Sencilla;1;Charles Martin Smith;2011;Drama | Cine familiar. Amistad. Animales. Delfines. ;Morgan Freeman, Pack con las dos peliculas en dos discos. Amary azul reciclable para dos discos. Warner Bros;
La gran aventura de Winter el delfin 2;Blu-Ray;Sencilla;1;Charles Martin Smith;2014;Drama. Infantil | Cine familiar. Animales. Delfines. ;Morgan Freeman, Pack con las dos peliculas en dos discos. Amary azul reciclable para dos discos. Warner Bros;
Warcraft el origen;Blu-Ray;Sencilla;2;Duncan Jones;2016;Fantástico. Aventuras | Fantasía medieval.;Coproducción Estados Unidos-China-Canadá-Japón. Incluye disco con pelicula en 3D. Universal. Legendary;
American History X;Blu-Ray;Sencilla;1;Tony Kaye;1998;Drama | Racismo. Drama carcelario. ;Edward Norton. Edición sencilla Blu-Ray. Amaray azul reciclable.Warner Bros;
Mortal Combat;Blu-Ray;Sencilla;1;Paul W.S. Anderson;1995;Acción. Fantástico | Artes marciales. Videojuego;Pack con las dos peliculas en dos discos. Amaray azul reciclable para dos discos. Warner Bros;
Mortal Combat Aniquilación;Blu-Ray;Sencilla;1;John R. Leonetti;1997;Acción. Fantástico | Artes marciales. Videojuego;Pack con las dos peliculas en dos discos. Amaray azul reciclable para dos discos. Warner Bros;
Dogman;Blu-Ray;Amaray Negro;1;Matteo Garrone;2018;Thriller. Drama | Crimen. Drogas.;Italia. Karma Films. Con Slip Cover. Caja Amaray negra.;
El fuego de la venganza;Blu-Ray;Sencilla;1;Tony Scott;2004;Thriller. Acción. Drama | Remake. Venganza;Denzel Washington. Con Slip Cover. Amaray azul reciclable. 20th Century Fox.;
Papá Cadillac;Blu-Ray;Sencilla;1;Greg Beeman;1988;Comedia | Comedia juvenil;Ref. 4678. 20th Century Fox;Caja 1, debajo cama (2)
El Rascacielos;Blu-Ray;Sencilla;1;Rawson Marshall Thurber;2018;Acción. Thriller | Secuestros / Desapariciones.;Legendary Pictures, FPC Production, Seven Bucks Productions. Distribuidora: Universal Pictures;Caja 3, debajo cama (1)
Evasión o Victoria;Blu-Ray;Sencilla;1;John Huston;1981;Drama. Acción | II Guerra Mundial. Deporte.;Ref. TS324. Sylvester Stallone, Michael Caine, Pelé;Caja 1, debajo cama (2)
Fuga de Colditz;Blu-Ray;Sencilla;1;Stuart Orme;2005;Serie de TV. Drama. Bélico | Miniserie de TV. Histórico;Blu-Ray R. Ref. LL1868. Feel Films. Granada Television, Power, Powercorp;Caja 1, debajo cama (2)
Capitán América El Soldado de Invierno;Blu-Ray;Sencilla;1;Anthony Russo, Joe Russo;2014;Acción. Thriller | Espionaje. Superhéroes.;Marvel Studios. Distribuido por Disney;
Capitán América el Primer Vengador;Blu-Ray;Sencilla;1;Joe Johnston;2011;Acción. Fantástico | Superhéroes.;Marvel Studios. Paramount. Distribuido por Disney;
Thor Ragnarok;Blu-Ray;Sencilla;1;Taika Waititi;2017;Fantástico. Acción. Aventuras. Comedia;Marvel Studios. Paramount. Distribuido por Disney;
Thor El mundo Oscuro;Blu-Ray;Sencilla;1;Alan Taylor;2013;Fantástico. Acción. Aventuras | Mitología.;Slip Cover Dorada (Fase DOS);
Thor;Blu-Ray;Sencilla;1;Kenneth Branagh;2011;Fantástico. Acción. Aventuras | Mitología.;Slip Cover Dorada (Fase UNO);
Dirty Dancing;Blu-Ray/DVD + DVD;Digibook;3;Emile Ardolino;1987;Romance. Drama | Drama romántico.;Edición Especial Coleccionista. LionsGate. DVD Dirty Dancing Concert tour y DVD de extras. Incluye postales. 24 paginas de imágenes y tríptico;
Poesia sin fin;Blu-Ray/DVD;Digipack;2;Alejandro Jodorowsky;2016;Drama | Años 40. Biográfico;Chile. Cameo. Edición digipack de cartón. DVD más Blu-Ray más libreto escrito por Diego Moldes.;
Detective Conan 22 Zero the Enforcer;Blu-Ray/DVD;Digipack;2;Yuzuru Tachikawa;2018;Animación. Intriga | Crimen;Divisa. Alfa Pictures. Edición digipack de cartón Incluye DVD de Extras,6 adhesivos y 1 libreto. La 22 pelicula de Detective Conan;
Venganza;Blu-Ray;Pack Steelbook;1;Pierre Morel;2008;Acción. Thriller | Secuestros / Desapariciones. Venganza;Pack Blu-Ray SteelBook con la trilogía. Liam Neeson. Caja con pegatinas (Caja metalica negra), 20th Century Fox. Francia;
Venganza: Conexión Estambul;Blu-Ray;Pack Steelbook;1;Olivier Megaton;2012;Acción. Thriller | Venganza. Secuestros / Desapariciones.;Pack Blu-Ray SteelBook con la trilogía. Liam Neeson. Caja con pegatinas (Caja metalica negra), 20th Century Fox. Francia;
Venganza 3;Blu-Ray;Pack Steelbook;1;Olivier Megaton;2015;Thriller. Acción | Venganza.;Pack Blu-Ray SteelBook con la trilogía. Liam Neeson. Caja con pegatinas (Caja metalica negra), 20th Century Fox. Francia;
Train To Busan;Blu-Ray;Steelbook;2;Yeon Sang-ho;2016;Terror. Acción. Ciencia ficción. Drama.  Zombis;A Contracorriente films. Incluye dos discos Blu-Ray. Disco 2: Seoul Station. Festival de Sitges 2016;
Django Desencadenado;Blu-Ray;Steelbook;1;Quentin Tarantino;2012;Western | Drama sureño. Esclavitud. Racismo.;Sony. Columbia Pictures.  Incluye Audio catalán.;
Chappie;Blu-Ray;Steelbook;1;Neill Blomkamp;2015;Ciencia ficción. Thriller. Acción | Robots. Distopía;Sony. Columbia Pictures. Incluye Audio catalán.;
Gladiator;Blu-Ray;Steelbook;1;Ridley Scott;2000;Acción. Aventuras. Drama | Antigua Roma. Esclavitud.;Universal. 5 Óscars.;
Malditos Bastardos;Blu-Ray;Steelbook;1;Quentin Tarantino;2009;Bélico. Acción. Comedia | II Guerra Mundial. Nazismo.;Universal;
Your Name;Blu-Ray;Steelbook;2;Makoto Shinkai;2016;Animación. Drama. Romance. Fantástico;Selecta Visión. CoMix Wave Films. Incluye Blu-Ray de Extras y una postal. Toho. 20th Century Fox.  Cartón exterior con cajón donde guardar el SteelBook;
Men in Black;Blu-Ray;Sencilla con funda cartón;1;Barry Sonnenfeld;1997;Ciencia ficción. Fantástico. Comedia. Acción;Men in Black La trilogia. Con funda de Cartón. Slip-cover. Pack en Amaray azul con las tres peliculas;
Men in Black 2;Blu-Ray;Sencilla con funda cartón;1;Barry Sonnenfeld;2002;Ciencia ficción. Fantástico. Comedia. Acción;Men in Black La trilogia. Con funda de Cartón. Slip-cover. Pack en Amaray azul con las tres peliculas;
Men in Black 3;Blu-Ray;Sencilla con funda cartón;1;Barry Sonnenfeld;2012;Ciencia ficción. Comedia. Acción | Extraterrestres. ;Men in Black La trilogia. Con funda de Cartón. Slip-cover. Pack en Amaray azul con las tres peliculas;
Parasito;Blu-Ray;Digipack;2;Takashi Yamazaki;2014;Ciencia ficción | Extraterrestres. Secuela. Manga. Live-Action;M3 (Mediatres estudio). Digipack con las dos partes de Parasito (La saga completa). Incluye libreto. Winds pf Asia;
Juez Dredd;Blu-Ray;Limitada funda cartón;1;Danny Cannon;1995;Ciencia ficción. Acción. Fantástico | Cómic.;Sylvester Stallone. Edición especial limitada 0379/1000. Incluye 8  postales. TS427. Caja de cartón con Amaray dentro.;Caja 1, debajo cama (2)
La Máscara;Blu-Ray;Limitada funda cartón;1;Chuck Russell;1994;Comedia. Fantástico | Mafia. Cómic;Jim Carrey. Edición especial limitada 1195/1900. Incluye 8  postales. TS384. Caja de cartón con Amaray dentro.;Caja 1, debajo cama (2)
House, una casa alucinante;DVD;Digipack;1;Steve Miner;1986;Terror. Fantástico. Comedia.  Comedia de terror.;House Saga Completa. 4 peliculas en DVD. Incluye 8 postales. Ed. limitada 0434/1500;
House II, aún más alucinante;DVD;Digipack;1;Ethan Wiley;1987;Terror. Fantástico. Comedia | Sobrenatural.;House Saga Completa. 4 peliculas en DVD. Incluye 8 postales. Ed. limitada 0434/1500;
House III;DVD;Digipack;1;James Isaac, David Blyth;1989;Terror. Fantástico. Comedia | Sobrenatural.;House Saga Completa. 4 peliculas en DVD. Incluye 8 postales. Ed. limitada 0434/1500;
House IV;DVD;Digipack;1;Lewis Abernathy;1992;Terror. Fantástico. Comedia | Comedia de terror;House Saga Completa. 4 peliculas en DVD. Incluye 8 postales. Ed. limitada 0434/1500;
Balto La leyenda del perro esquimal;DVD;Sencilla;1;Simon Wells;1995;Animación. Aventuras. Infantil. Drama;Universal. Edición sencilla en DVD (2002);
El Rey Leon 2;DVD;Sencilla;1;Darrell Rooney, Rob LaDuca;1998;Animación. Comedia. Romance. Musical. Infantil;Edición DVD de segunda mano comprado en Cex. Edición especial. Walt Disney Pictures / Disney;
El Rey Leon 3;DVD;Sencilla;1;Bradley Raymond;2004;Animación. Comedia. Infantil | África;Edición DVD de segunda mano comprado en Cex (no incluye segundo disco). Edición especial. Walt Disney Pictures / Disney;
Pippi Calzaslargas;DVD;Sencilla con funda cartón;3;Olle Hellbom;1969;Serie de TV. Comedia. Infantil. Aventuras;Suecia. Planeta Junior. Serie completa 21 episodios remasterizada. DVD en funda de carton con 4 postales. 39 Escalones;
A toda Marcha;DVD;Sencilla;1;Fritz Kiersch;1985;Drama | Bandas/pandillas callejeras;Robert Downey JR. Ref. TS 179;
La abeja Maya: Los juegos de la miel;DVD;Sencilla;1;Noel Cleary, Alexs Stadermann;2017;Animación. Infantil | Secuela. Insectos;"Distribuido por Sony. Co-production Australia-Alemania; Studio 100, Studio B Animation, Flying Bark Productions. Audio catalán";
Gigolo (Just a Gigolo);DVD;Pack DVD Sencillo;1;David Hemmings;1979;Drama | Prostitución. Años 20;5 Peliculas de David Bowie en un pack. Alemania del Oeste (RFA);
El ansia;DVD;Pack DVD Sencillo;1;Tony Scott;1983;Terror. Romance | Vampiros. Homosexualidad;5 Peliculas de David Bowie en un pack.;
Cuando llega la noche;DVD;Pack DVD Sencillo;1;John Landis;1985;Comedia;5 Peliculas de David Bowie en un pack.;
Absolute Beginners (Principiantes);DVD;Pack DVD Sencillo;1;Julien Temple;1986;Musical. Drama. Romance | Años 50. Racismo;5 Peliculas de David Bowie en un pack.;
Basquiat;DVD;Pack DVD Sencillo;1;Julian Schnabel;1996;Drama | Biográfico. Pintura. Años 80;5 Peliculas de David Bowie en un pack.;
El Aviador;DVD;Steelbook;2;Martin Scorsese;2004;Drama | Biográfico. Cine dentro del cine. Aviones. Años 20;Star MetalPack Patent Pending. DVD con la pelicula y DVD con contenidos especiales. Caracteristicas impresas en el propio metal.;
Aladdin;DVD;Pack Cartón 3 DVD;1;John Musker, Ron Clements;1992;Animación. Fantástico. Musical. Infantil. Aventuras;Colección 3 Peliculas Aladdín 1, 2 & 3.;
El retorno de Jafar;DVD;Pack Cartón 3 DVD;1;Toby Shelton, Tad Stones, Zaslove;1994;Animación. Aventuras. Fantástico. Infantil | Secuela;Colección 3 Peliculas Aladdín 1, 2 & 3.;
Aladdin y el rey de los ladrones;DVD;Pack Cartón 3 DVD;1;Tad Stones;1995;Animación. Aventuras. Musical. Infantil | Secuela;Colección 3 Peliculas Aladdín 1, 2 & 3.;
Fraggle Rock;DVD;Pack DVD Sencillo;4;Jim Henson;1983;Serie de TV. Animación. Infantil. Comedia. Musical | Marionetas;Primera temporada completa. 24 episodios. Los Fraguel (Serie de TV) Ref. TS349;
Comando G - La batalla de los planetas;DVD;Pack DVD Sencillo;7;David E. Hanson;1978;Serie de TV. Animación. Acción. Ciencia ficción. Aventuras;Temporada 1 - 26 Episodios. ;
Pumping Iron;DVD;Sencilla;1;George Butler, Robert Fiore;1977;Documental. Drama | Documental deportivo;Arnold Schwarzenegge. Documental. Realizado en 1975 (comercializado en 1977);
La Barraca;Blu-Ray;Sobre Cartón;2;León Klimovsky;1979;Serie de TV. Drama | Miniserie de TV;Miniserie de 9 episodios. Divisa. CRTVE SAU 2012;
La Tortuga Roja;Blu-Ray/DVD + CD;Digipack Coleccionista;3;Michael Dudok de Wit;2016;Animación. Aventuras. Drama. Fantástico | Naturaleza;"Historia muda. Coproducción Francia-Bélgica-Japón; Why Not Productions / Wild Bunch / Studio Ghibli. Incluye CD con la banda sonora y libreto de 32 páginas. Karma Films";
El niño y la bestia;Blu-Ray/DVD + CD;Digipack Coleccionista;3;Mamoru Hosoda;2015;Animación. Fantástico | Amistad. Monstruos. Familia;Edición limitada 0606/1509 unidades. A Contracorriente Films. Sitges 2015. Con doblaje catalán. Incluye CD con la banda sonora y libreto de 40 páginas.;
Nostalgia;DVD;Sencilla con libreto;2;Andrei Tarkovsky;1983;Drama | Drama psicológico;Colección Andrei Tarkovsky 2DVD. Edición especial 2 discos contiene libreto de 24 páginas.;
El espejo;DVD;Sencilla con libreto;1;Andrei Tarkovsky;1975;Drama | Familia. Infancia. Años 30. Años 40. II Guerra;Colección Andrei Tarkovsky. Unión Soviética (URSS). Incluye libreto de 24 páginas;
Andrei Rublev;DVD;Sencilla con libreto;2;Andrei Tarkovsky;1966;Drama | Biográfico. Siglo XV. Edad Media. Religión.;Colección Andrei Tarkovsky. Unión Soviética (URSS). Incluye libreto de 24 páginas;
La infancia de Iván;DVD;Sencilla con libreto;1;Andrei Tarkovsky;1962;Drama. Bélico | II Guerra. Espionaje. Nacismo;Colección Andrei Tarkovsky. Unión Soviética (URSS). Incluye libreto de 24 páginas;
Vis a Vis;Blu-Ray;Pack Blu-Ray Sencillo;7;Iván Escobar, Esther Martínez Lobato, Daniel Écija, Álex Pina;2015;Serie de TV. Thriller. Drama | Drama carcelario;"Serie completa (hasta la fecha) 2 temporadas. Emitida por Antena 3 Televisión, FOX; Globomedia. Divisa. Más de 9 horas de extras.";
Sin identidad;Blu-Ray;Pack Blu-Ray Sencillo;7;Sergi Belbel (Creator), Joan Noguera;2014;Serie de TV. Drama | Secuestros / Desapariciones;Serie completa. ATRESMEDIA Corporación para Divisa Home Video.;
El mundo en Guerra;Blu-Ray;Pack Blu-Ray Sencillo;9;Jeremy Isaacs (Creator), Hugh Raggett, John Pett;1974;Documental. Serie de TV. Bélico | Documental sobre Historia;Llamentol. Edición cutre con caratula fotocopiada. Serie Documental. Caja negra con 9 discos.;
