Titulo;Formato;Edicion;discos;Director;Year;Genero;Observaciones;Localizacion
Los niños lobo (Wolf Children);Blu-Ray/DVD;Digibook;2;Mamoru Hosoda;2012;Animación. Drama. Fantástico | Familia.;Selecta Visión. Studio Chizu. Madhouse. Nippon TV. Toho. 20TH Century Fox. Colección Mamoru Hosoda. Edición 2016;
El lugar que nos prometimos;Blu-Ray/DVD;Digibook;2;Makoto Shinkai;2004;Animación. Ciencia ficción. Drama. Romance | Amistad;Selecta Visión. CoMix Wave Films. Viz Media. 20th Century Fox. Edición 2017. Contiene varias entrevistas. Colección Makoto Shinkai;
5 centímetros por segundo;Blu-Ray/DVD;Digibook;2;Makoto Shinkai;2007;Animación. Drama. Romance;Selecta Visión. CoMix Wave Films. 20th Century Fox. Colección Makoto Shinkai;
Viaje a Agartha;Blu-Ray/DVD;Digibook;2;Makoto Shinkai;2011;Animación. Fantástico. Aventuras. Drama;Selecta Visión. Viz Media. 20th Century Fox. Incluye DVD de extras. Colección Makoto Shinkai;
El jardín de las palabras;Blu-Ray/DVD;Digibook;2;Makoto Shinkai;2013;Animación. Drama. Romance | Adolescencia;Selecta Visión. CoMix Wave Films. 20th Century Fox. Mediometraje (46min). Colección Makoto Shinkai;
Your Name;Blu-Ray/DVD;Digibook;2;Makoto Shinkai;2016;Animación. Drama. Romance. Fantástico;Selecta Visión. Toho. CoMix Wave Films. 20th Century Fox. Incluye DVD de extras. Colección Makoto Shinkai. Edición 2018;
Ancien y el mundo mágico;Blu-Ray;Amaray Lila;1;Kenji Kamiyama;2017;Animación. Drama. Ciencia ficción | Robots;M3 (Mediatres estudio) Winds of Asia. Signal MD. Production I.G. Bandai. Kadokawa. NTV. Incluye audio catalán y libreto y 3 postales. Funda de cartón;
El himno del corazón;Blu-Ray/DVD;Coleccionista;2;Tatsuyuki Nagai;2015;Animación. Drama | Amistad. Música. Adolescencia.;Selecta Visión. Production I.G. 20th Century Fox. Ed. Coleccionista con amaray azul, funda de cartón. Incluye 2 libretos;
La isla de Giovanni;Blu-Ray/DVD + DVD;Coleccionista;3;Mizuho Nishikubo;2014;Animación. Drama | Infancia. II Guerra Mundial. Basado en hechos reales;Selecta Visión. A-1 Pictures. Aniplex. 20th Century Fox. Incluye Pelicula en DVD, Blu-Ray y DVD de extras. Ed. Coleccionista con amaray azul, funda de cartón. Incluye libreto de 32 páginas. Sitges 2014;
El verano de Coo;Blu-Ray/DVD;Digibook;2;Keiichi Hara;2007;Animación. Fantástico. Aventuras. Comedia. Drama;Selecta Visión. Shin-Ei Animation. 20th Century Fox. Colección Keiichi Hara. Incluye DVD de extras. Edición 2016;
Colorful;Blu-Ray/DVD;Digibook;2;Keiichi Hara;2010;Animación. Fantástico. Drama | Sobrenatural.;Selecta Visión. Sunrise. Toho. 20th Century Fox. Colección Keiichi Hara. Incluye DVD de extras. Edición 2016. Sitges 2010;
Sarusuberi: Miss Hokusai;Blu-Ray/DVD;Digibook;2;Keiichi Hara;2015;Animación. Drama | Siglo XIX. Japón feudal. Manga.;Selecta Visión. Production I.G. 20th Century Fox. Colección Keiichi Hara. Edición 2016. Incluye DVD de extras. Sitges 2015;
Gurren Lagann: El fin de la infancia;Blu-Ray/DVD;Coleccionista;2;Hiroyuki Imaishi;2008;Animación. Ciencia ficción. Comedia. Acción. Aventuras.;Selecta Visión. Aniplex. 20th Century Fox. Pack con las dos peliculas en DVD y BR. Ed. Coleccionista con amaray azul, funda de cartón. Incluye 2 libretos. Ed. 2014;
Gurren Lagann: Las luces en el cielo son estrellas;Blu-Ray/DVD;Coleccionista;2;Hiroyuki Imaishi, Masahiko Otsuka;2009;Animación. Aventuras. Drama. Comedia. Ciencia ficción. Acción | Secuela. Robots;Selecta Visión. Aniplex. 20th Century Fox. Pack con las dos peliculas en DVD y BR. Ed. Coleccionista con amaray azul, funda de cartón. Incluye 2 libretos. Ed. 2014;
Akira;Blu-Ray/DVD + DVD + CD;Coleccionista;4;Katsuhiro ?tomo;1988;Animación. Ciencia ficción. Acción. Thriller;Selecta Visión. Kodansha. Akira Committee Company Ltd. Incluye película en DVD y BR, DVD de extras y CD  con la BSO. Ed. Coleccionista con amaray azul, funda de cartón. Incluye libreto. Ed. 2014 ;
Dragon Ball Z: La batalla de los dioses (Battle of Gods);Blu-Ray/DVD + DVD;Digipack Coleccionista;3;Masahiro Hosoda;2013;Animación. Ciencia ficción. Acción | Artes marciales.;Selecta Visión. Edición Extendida. Toei Animation. 20th Century Fox. (25min nuevos de metraje). Ed. Coleccionista Digipack. Incluye libreto con todos los pósters de las películas de DB. Ed. 2015;
Dragon Ball Z: La Resurrección de F;Blu-Ray/DVD + DVD;Digipack Coleccionista;3;Tadayoshi Yamamuro;2015;Animación. Acción. Ciencia ficción. Comedia | Artes marciales;Selecta Visión. Toei Animation. 20th Century Fox. Ed. Coleccionista Digipack. Blu-Ray y DVD con la pelicula y DVD de extras. Incluye libreto de 28 páginas. Logo 30 aniversario. Edicion 2016.;
MazinKaiser ¡Combate a Muerte contra el General Negro!;Blu-Ray/DVD;Coleccionista;2;Masahiko Murata;2003;Animación. Ciencia ficción. Acción | Robots;Selecta Visión. Showgate. 20th Century Fox. Ed. Coleccionista con amaray azul, funda de cartón. Película en DVD y BR. Incluye libreto de 24 páginas y desplegable organigrama Mikene.;
Puella Magi Madoka Magica;Blu-Ray;Sencilla con funda cartón;3;Akiyuki Shinbo;2011;Serie de TV. Animación. Fantástico | Magia. Brujería.;Selecta Visión. Aniplex. 20th Century Fox. Amaray azul, Slip-case. Serie completa 12 episodios en 3 BR. Edición 2014.;
Puella Magi Madoka Magica 3: Rebellion;Blu-Ray/DVD + Blu-Ray;Coleccionista;3;Akiyuki Shinbo, Yukihiro Miyamoto;2013;Animación. Fantástico. Drama | Secuela. Magia;Selecta Visión. Aniplex. 20th Century Fox. Ed. Coleccionista con amaray azul, funda de cartón. Película en DVD y BR y BR de extras. Incluye libreto de 56 páginas.  Edición 2015;
Zetman ;Blu-Ray;Sencilla con funda cartón;3;Osamu Nabeshima Anthony Tortorici;2012;Serie de TV. Animación. Acción. Ciencia ficción | Manga;Selecta Visión. TMS Entertainment. Shueisha. 20th Century Fox. Serie completa 13 episodio.  Amaray azul, Slip-case. Edición 2014;
Shin Chan: Operación rescate;DVD;Sencilla;1;Keiichi Hara;1998;Animación. Comedia. Infantil | Manga. Infancia.;LUK INTERNATIONAL. Distribuida comercialmente por Walt Disney. Audio Catalán. Incluye libreto.;
Shin Chan y la ambición de Karakaka;DVD;Sencilla;1;Mitsuru Hongo;1995;Animación. Comedia | Siglo XVIII. Artes marciales.;LUK INTERNATIONAL. Distribuida comercialmente por Buena Vista Home. Audio Catalán. Incluye libreto. Incluye corto las aventuras del cerdito valiente vol. 2. Slip-Cover;
Mazinger: Edición Z Impacto;Blu-Ray;Coleccionista;6;Yasuhiro Imagawa;2009;Serie de TV. Animación. Ciencia ficción. Acción;Selecta Visión. Bandai Visual. 20th Century Fox. Serie completa 26 episodios. Adaptación libre del manga Mazinger Z. Incluye Libreto de 88 páginas. Ed. 2014;
Ataque a los Titanes: El rugido del despertar;Blu-Ray;Sencilla;1;Tetsur? Araki, Masashi Koizuka;2018;Animación. Fantástico. Acción | Manga. Secuela;"Selecta Visión. Kodansha. 20th Century Fox. Tercera película de la saga, que recapitula los episodios del 26-37 contando el arco ""Enfrentamiento de Titanes"" . Edición 2019";
Shin Chan y la Princesa del Espacio;Blu-Ray;Sencilla;1;Sôichi Masui;2012;Animación. Comedia | Manga;Selecta Visión. Luk International. Shin-Ei Animation. 20th Century Fox. Edición 2016;
Shin Chan: El secreto está en la salsa;Blu-Ray;Sencilla;1;Masakazu Hashimoto;2013;Animación. Comedia | Manga;Selecta Visión. Luk International. Shin-Ei Animation. 20th Century Fox. Edición 2016;
Shin Chan: Papá Robot;Blu-Ray;Sencilla;1;Wataru Takahashi;2014;Animación. Comedia. Fantástico. Infantil | Robots;Selecta Visión. Luk International. Shin-Ei Animation. 20th Century Fox. Edición 2016;
Sagrada Reset;Blu-Ray;Sencilla con funda cartón;3;Shinya Kawamo;2017;Serie de TV. Animación. Drama. Ciencia ficción;Selecta Visión. David Production. 20th Century Fox. Serie completa 24 episodios. Slip-case. Incluye libreto de 24 páginas. Edición 2018;
Toy Story 4;Blu-Ray;Steelbook;2;Josh Cooley;2019;Animación. Fantástico. Aventuras. Comedia;Pixar Animation Studios. Distribuida por Walt Disney. Incluye Blu-Ray de extras. Cartón exterior con cajón donde guardar el SteelBook;
Quiero comerme tu páncreas;Blu-Ray/DVD;Digipack Coleccionista;2;Shin'ichirô Ushijima;2018;Animación. Drama. Romance | Amistad. Enfermedad;Selecta Visión. Aniplex. Studio VOLN. 20th Century Fox. Incluye 2 libros. Edición 2019.;
Maquia, una historia de amor inmortal;Blu-Ray/DVD;Digipack Coleccionista;2;Mari Okada;2018;Animación. Drama. Fantástico. Aventuras ;Selecta Visión. P.A. Works. 20th Century Fox. Película en DVD y BR. Incluye 3 libros y 2 postales. Sitges 2018. Edición 2019;
A Silent Voice;Blu-Ray/DVD + Blu-Ray;Digipack Coleccionista;3;Naoko Yamada;2016;Animación. Drama. Romance | Drama romántico. Amistad.;Selecta Visión. Viz Media. ABC animation. 20th Century Fox. Incluye película en DVD y BR y BR de extras. Incluye libro de 24 páginas y postal. Edición 2018;
Mazinger Z Infinity;Blu-Ray/DVD;Digipack Coleccionista;2;Junji Shimizu;2017;Animación. Acción. Ciencia ficción. Fantástico;Selecta Visión. Toei Animation. 20th Century Fox. Logo 50 aniversario Go Nagai. Película en DVD y BR. Incluye Booklet original del esteno en cines y 2 postales. Edicion 2018;
Mary y la flor de la bruja;Blu-Ray;Digipack Coleccionista;2;Hiromasa Yonebayashi;2017;Animación. Fantástico. Aventuras | Magia. Brujería;Selecta Visión. Studio Ponoc. Pelicula en Blu-Ray y BR de extras. Incluye libreto de 48 páginas. Edición 2019;
Sword Art Online the Movie: Ordinal Scale;Blu-Ray/DVD;Digipack Coleccionista;2;Tomohiko Ito;2017;Animación. Fantástico | Internet / Informática.;Selecta Visión. A-1 Pictures. Sao Movie Project. 20th Century Fox. Pelicula en DVD y BR. Incluye 2 Libretos y 3 postales. (Aniplex) Edición 2018;
One Piece Gold;Blu-Ray/DVD + DVD;Digipack Coleccionista;3;Hiroaki Miyamoto;2016;Animación. Aventuras. Comedia | Piratas. Manga;Selecta Visión. Toei Animation. 20th Century Fox. Pelicula en DVD y BR y DVD de extras. Incluye libro de 24 páginas. Audio catalán. Edición 2017;
Dragon Ball Super: Broly;Blu-Ray/DVD + DVD;Digipack Coleccionista;3;Tatsuya Nagamine;2018;Animación. Ciencia ficción. Acción;Selecta Visión. Toei Animation. Shueisha. Bird Studio. 20th Century Fox. Incluye pelicula en DVD y BR y DVD de extras. Incluye libreto de 16 páginas. Edición 2019;
Dragon Ball Super: Broly;Blu-Ray/DVD;Steelbook;2;Tatsuya Nagamine;2018;Animación. Ciencia ficción. Acción;Selecta Visión. Toei Animation. Shueisha. Bird Studio. 20th Century Fox. Incluye pelicula en BR y DVD de extras. Edición 2020.  Cartón exterior con cajón donde guardar el SteelBook.;
Patlabor: La película;Blu-Ray;Digipack Coleccionista;1;Mamoru Oshii;1989;Animación. Ciencia ficción. Drama. Intriga. Thriller;Selecta Visión. Viz media. 20th Century Fox. Ed. Coleccionista con la Trilogía completa. 3 peliculas más 2 DVD de extras. Incluye libro. Edición 2018;
Patlabor 2: La película;Blu-Ray/DVD;Digipack Coleccionista;2;Mamoru Oshii;1993;Animación. Ciencia ficción. Drama. Intriga. Thriller.;Selecta Visión. Viz media. 20th Century Fox. Ed. Coleccionista con la Trilogía completa. 3 peliculas más 2 DVD de extras. Incluye libro. Edición 2019;
WXIII: Patlabor the Movie 3;Blu-Ray/DVD;Digipack Coleccionista;2;Takuji Endo, Fumihiko Takayama;2002;Animación. Ciencia ficción. Acción | Crimen. Robots.;Selecta Visión. Viz media. 20th Century Fox. Ed. Coleccionista con la Trilogía completa. 3 peliculas más 2 DVD de extras. Incluye libro. Edición 2020;
Patlabor: La película;Blu-Ray/DVD;Coleccionista;2;Mamoru Oshii;1989;Animación. Ciencia ficción. Drama. Intriga. Thriller;Selecta Visión. Viz media. 20th Century Fox. Pelicula en DVD y BR. Libro de 48 páginas. Edición 2015;
Patlabor 2: La película;Blu-Ray/DVD + DVD;Coleccionista;3;Mamoru Oshii;1993;Animación. Ciencia ficción. Drama. Intriga. Thriller.;Selecta Visión. Viz media. 20th Century Fox. Pelicula en DVD y BR y DVD de extras. Incluye libro de 52 páginas. Edición 2015;
WXIII: Patlabor the Movie 3;Blu-Ray/DVD + DVD;Coleccionista;3;Takuji Endo, Fumihiko Takayama;2002;Animación. Ciencia ficción. Acción | Crimen. Robots.;Selecta Visión. Viz media. 20th Century Fox. Pelicula en DVD y BR y DVD de extras. Incluye librito de 15 páginas. Edición 2016;
Appleseed: The Beginning;DVD;Coleccionistas;2;Shinji Aramaki;2004;Animación. Ciencia ficción. Acción. Thriller;Selecta Visión. Geneon. Distribuido por Universal. Pelicula en DVD y DVD de extras. Digipack dentro de caja con tapa. 8 postales. Libro 48 pág. Cartel del estreno en cines. Sitges 2004. Edición limitada 1643-1999. Edición 2005;
Steamboy;DVD;Coleccionista;2;Katsuhiro ?tomo;2004;Animación. Ciencia ficción. Bélico | Steampunk;Screen Gems. Distribuido por Sony Pictures. Bandai Visual. Mash Room/Steamboy Committee. Studio 4°C. Formato digipack con funda deslizable, todo dentro de una caja marrón. Incluye 2DVD, libreto de 166 páginas. Comic original, postales (10 tarjetas). Part nº 03007;
Harry Potter y la piedra filosofal;Blu-Ray/DVD + DVD + Blu-Ray;Colección Hogwarts;4;Chris Columbus;2001;Fantástico. Aventuras. Infantil | Magia. Young Adult;Warner Bros. Año 1. Pelicula en BR (Versión  de cine y extendida) y en DVD (versión de cine). Incluye DVD de extras y BR con parte 1 de Creando el mundo de Harry Potter - La magia comienza;
Harry Potter y la cámara secreta;Blu-Ray/DVD + DVD + Blu-Ray;Colección Hogwarts;4;Chris Columbus;2002;Fantástico. Aventuras. Infantil | Magia. Young Adult;Warner Bros. Año 2. Pelicula en BR (Versión  de cine y extendida) y en DVD (versión de cine). Incluye DVD de extras y BR con parte 2 de Creando el mundo de Harry Potter - Personajes;
Harry Potter y el prisionero de Azkaban;Blu-Ray/DVD + DVD + Blu-Ray;Colección Hogwarts;4;Alfonso Cuarón;2004;Fantástico. Aventuras. Drama | Magia. Viajes en el tiempo.;Warner Bros. Año 3. Pelicula en BR y en DVD. Incluye DVD de extras y BR con parte 3 de Creando el mundo de Harry Potter - Criaturas;
Harry Potter y el cáliz de fuego;Blu-Ray/DVD + DVD + Blu-Ray;Colección Hogwarts;4;Mike Newell;2005;Fantástico. Aventuras. Drama | Magia. Young Adult.;Warner Bros. Año 4. Pelicula en BR y en DVD. Incluye DVD de extras y BR con parte 4 de Creando el mundo de Harry Potter - Sonido y Música;
Harry Potter y la orden del Fénix;Blu-Ray/DVD + Blu-Ray;Colección Hogwarts;3;David Yates;2007;Fantástico. Aventuras. Drama | Magia.;Warner Bros. Año 5. Pelicula en BR y en DVD. BR con parte 5 de Creando el mundo de Harry Potter - Evolución;
Harry Potter y el misterio del príncipe;Blu-Ray/DVD + Blu-Ray;Colección Hogwarts;3;David Yates;2009;Fantástico. Aventuras. Drama | Magia.;Warner Bros. Año 6. Pelicula en BR y en DVD. BR con parte 6 de Creando el mundo de Harry Potter - Efectos Mágicos;
Harry Potter y las reliquias de la muerte - Parte 1;Blu-Ray/DVD + Blu-Ray + 3D;Colección Hogwarts;4;David Yates;2010;Fantástico. Aventuras. Drama | Magia;Warner Bros. Año 7 parte 1. Pelicula en BR y en DVD y en BR-3D. BR con parte 7 de Creando el mundo de Harry Potter - Historia;
Harry Potter y las reliquias de la muerte - Parte 2;Blu-Ray/DVD + Blu-Ray + 3D;Colección Hogwarts;4;David Yates;2011;Fantástico. Aventuras. Drama | Secuela. Magia.;Warner Bros. Año 7 parte 2. Pelicula en BR y en DVD y en BR-3D. BR con parte 8 de Creando el mundo de Harry Potter - Creciendo;
Harry Potter Colección Hogwarts Bonus disc;Blu-Ray;Colección Hogwarts;1;;2011;;BR extra que incluye: Cuando Harry dejó Hogwarts, Los 50 mejores momentos de HP. Diseñando el mundo de HP. Secretos revelados. Los HP que nunca habias conocido. Set total de 31 discos;
Nausicaä del Valle del Viento;Blu-Ray/DVD;Digibook;2;Hayao Miyazaki;1984;Animación. Aventuras. Fantástico. Ciencia ficción;Studio Ghibli Collection Deluxe.eone. Pelicula en DVD y BR;
Nicky, la aprendiz de bruja;Blu-Ray/DVD;Digibook;2;Hayao Miyazaki;1989;Animación. Fantástico. Aventuras. Infantil ;Studio Ghibli Collection Deluxe.eone. Pelicula en DVD y BR;
Arrietty y el mundo de los diminutos;Blu-Ray/DVD;Digibook;2;Hiromasa Yonebayashi;2010;Animación. Fantástico. Drama. Infantil ;Studio Ghibli Collection Deluxe. eone. Pelicula en DVD y BR;
Porco Rosso;Blu-Ray/DVD;Digibook;2;Hayao Miyazaki;1992;Animación. Fantástico. Aventuras | Años 30.;Studio Ghibli Collection Deluxe. eone. Pelicula en DVD y BR;
El castillo en el cielo;Blu-Ray/DVD;Digibook;2;Hayao Miyazaki;1986;Animación. Fantástico. Aventuras | Steampunk.;Studio Ghibli Collection Deluxe. eone. Pelicula en DVD y BR;
La princesa Mononoke;Blu-Ray/DVD;Digibook;2;Hayao Miyazaki;1997;Animación. Fantástico. Aventuras | Cine épico.;Studio Ghibli Collection Deluxe. eone. Pelicula en DVD y BR;
La tumba de las luciérnagas;Blu-Ray/DVD;Digibook;2;Isao Takahata;1988;Animación. Drama. Bélico | II Guerra Mundial.;Studio Ghibli Collection Deluxe. Selecta Visión. Toho. 20th Century Fox. Pelicula en BR y DVD de extras. Ed. 2016;
Lupin III: El castillo de Cagliostro;Blu-Ray/DVD;Digibook;2;Hayao Miyazaki;1979;Animación. Fantástico. Acción. Aventuras | Manga;Studio Ghibli Collection Deluxe. Selecta Visión. Tokyo Movie Shinsha (TMS) 20th Century Fox. Pelicula en DVD y BR. Ed. 2016;
El verano de Coo;Blu-Ray/DVD + DVD;Coleccionista;3;Keiichi Hara;2007;Animación. Fantástico. Aventuras. Comedia. Drama;Selecta Visión. Shin-Ei Animation. Sony. Pelicula en DVD y BR. Incluye DVD de extras y libro. Edición 2013;
Colorful;Blu-Ray/DVD + DVD;Coleccionista;3;Keiichi Hara;2010;Animación. Fantástico. Drama | Sobrenatural.;Selecta Visión. Sunrise. Toho. 20th Century Fox. Pelicula en DVD y BR. Incluye DVD de extras y libro. Edición 2014. Sitges 2010;
Sarusuberi: Miss Hokusai;Blu-Ray/DVD + DVD;Coleccionista;3;Keiichi Hara;2015;Animación. Drama | Siglo XIX. Japón feudal. Manga.;Selecta Visión. Production I.G. 20th Century Fox. Pelicula en DVD y BR. Incluye DVD de extras y libro. Edición 2015. Sitges 2015;
La chica que saltaba a través del tiempo;Blu-Ray/DVD + DVD;Coleccionista;3;Mamoru Hosoda;2006;Animación. Ciencia ficción. Romance. Drama;Selecta Visión. Mad House Ltd. 20th Century Fox. Sitges 2007. Pelicula en DVD y BR. Incluye DVD de extras y libro. doblaje catalán. Ed. 2013;
Summer Wars;Blu-Ray/DVD + DVD;Coleccionista;3;Mamoru Hosoda;2009;Animación. Fantástico. Ciencia ficción. Comedia;Selecta Visión. Viz Media. NTV (Nippon Television Network). 20th Century Fox. Pelicula en DVD y BR. Incluye DVD de extras y libro. Edición 2013;
Los niños lobo (Wolf Children);Blu-Ray/DVD + DVD;Coleccionista;3;Mamoru Hosoda;2012;Animación. Drama. Fantástico | Familia.;Selecta Visión. Studio Chizu. Madhouse. Nippon TV. Toho. Viz media. 20TH Century Fox. Pelicula en DVD y BR. Incluye DVD de extras y libro. Edición 2013;
Viaje a Agartha;Blu-Ray/DVD + DVD;Coleccionista;3;Makoto Shinkai;2011;Animación. Fantástico. Aventuras. Drama;Selecta Visión. Viz Media. 20th Century Fox. Pelicula en DVD y BR. Incluye DVD de extras y libro. Edición.2013;
El jardín de las palabras;Blu-Ray/DVD;Coleccionista;2;Makoto Shinkai;2013;Animación. Drama. Romance | Adolescencia;Selecta Visión. CoMix Wave Films. 20th Century Fox. Mediometraje (46min). Ed. 2014;
One Piece: La película;Blu-Ray;Amaray Rojo;1;Atsuji Shimizu;2000;Animación. Aventuras. Comedia. Fantástico. Acción;Selecta Visión. Toei Animation. 20th Century Fox. Mediometraje (51 min)  Film 1. Edición 2017;
One Piece: Aventura en la Isla Espiral;Blu-Ray;Amaray Rojo;1;Atsuji Shimizu;2001;Animación. Aventuras. Comedia. Fantástico. Acción;Selecta Visión. Toei Animation. 20th Century Fox. Mediometraje (55 min) Film 2. Extra: Especial Jango's Dance Carnival (5 min). Edición 2017;
One Piece. El reino de Chopper en la isla de los animales raros;Blu-Ray;Amaray Rojo;1;Atsuji Shimizu;2002;Animación. Aventuras. Comedia. Fantástico. Acción;Selecta Visión. Toei Animation. 20th Century Fox. Mediometraje (56 min) Film 3. Extra: Especial Soccer King (6 min). Edición 2017;
One Piece. La aventura sin salida;Blu-Ray;Amaray Rojo;1;Kônosuke Uda;2003;Animación. Aventuras. Comedia. Fantástico. Acción;Selecta Visión. Toei Animation. 20th Century Fox. Film 4. Edición 2017;
One Piece: La maldición de la espada sagrada;Blu-Ray;Amaray Rojo;1;Kazuhisa Takenouchi;2004;Animación. Aventuras. Comedia. Fantástico;Selecta Visión. Toei Animation. 20th Century Fox. Film 5. Extra: Baseball (5 min).  Edición 2017;
One Piece: El barón Omatsuri y la Isla Secreta;Blu-Ray;Amaray Rojo;1;Mamoru Hosoda;2005;Animación. Aventuras. Fantástico. Acción;Selecta Visión. Toei Animation. 20th Century Fox. Film 6. Edición 2017;
One Piece: El gran soldado mecánico del castillo Karakuri;Blu-Ray;Amaray Rojo;1;Kônosuke Uda;2006;Animación. Aventuras. Comedia. Fantástico | Piratas;Selecta Visión. Toei Animation. 20th Century Fox. Film 7. Edición 2017;
One Piece: Episodio de Arabasta: La princesa del desierto y los piratas;Blu-Ray;Amaray Rojo;1;Takahiro Imamura;2007;Animación. Aventuras. Comedia. Fantástico | Piratas.;Selecta Visión. Toei Animation. 20th Century Fox. Film 8. Edición 2017;
One Piece: Episodio de Chopper: Episodio de Chopper Plus: Florece el invierno, el milagro de los cerezos;Blu-Ray;Amaray Rojo;1;Junji Shimizu;2008;Animación. Aventuras. Comedia. Fantástico;Selecta Visión. Toei Animation. 20th Century Fox. Film 9. Edición 2017;
One Piece: Strong World;Blu-Ray;Amaray Rojo;1;Munehisa Sakai;2009;Animación. Aventuras. Comedia. Fantástico;Selecta Visión. Toei Animation. 20th Century Fox. Film 10. Edición 2016 (Se lanzarón junto con Gold para el lanzamiento en cines en España);
One Piece 3D: Persecución del sombrero de paja;Blu-Ray 3D;Amaray Rojo;1;Hiroyuki Sato;2011;Animación. Comedia. Aventuras | Piratas. Manga;Selecta Visión. Toei Animation. 20th Century Fox. Mediometraje (30 min) Edición 2017;
One Piece Film Z;Blu-Ray;Amaray Rojo;1;Tatsuya Nagamine;2012;Animación. Comedia. Aventuras | Piratas.;Selecta Visión. Toei Animation. 20th Century Fox. Film 11. Edición 2016 (Se lanzarón junto con Gold para el lanzamiento en cines en España);
One Piece Gold;Blu-Ray;Amaray Rojo;1;Hiroaki Miyamoto;2016;Animación. Aventuras. Comedia | Piratas.;Selecta Visión. Toei Animation. 20th Century Fox. Film 12. Doblaje al catalán. Edición 2016;
El viaje de Chihiro;Blu-Ray/DVD;Coleccionista;2;Hayao Miyazaki;2001;Animación. Fantástico. Aventuras | Dragones.;Vértigo. Studio Ghibli. Distribuido por Sony. Ed. Coleccionista en caja negra. Pelicula en DVD y BR en digipack de tres palas, sin funda de cartón. Incluye Doble poster, 3 láminas, libro de 56 páginas y Moneda de metal exclusiva de Studio Ghibli con relieve de Chihiro.;
Akira;Blu-Ray/DVD + DVD + CD;A4;4;Katsuhiro ?tomo;1988;Animación. Ciencia ficción. Acción. Thriller | Cyberpunk. Thriller futurista.;Selecta Visión. Kodansha. 20th Century Fox. Pelicula en DVD y BR + DVD de extras + CD con la BSO. Caja contenedora tamaño A4. Artbook A4 de 56 pág. Libro A4 de 32 pág. Incluye Steelbook de Akira con hueco para dos discos. Edición limitada Nº 0896/1000 y exclusiva salón del manga XXIV;
Your Name;Blu-Ray/DVD + Blu-Ray + CD;A4;4;Makoto Shinkai;2016;Animación. Drama. Romance. Fantástico;Selecta Visión. TOHO. CoMix Wave Films. 20th Century Fox. Pelicual en DVD y BR, BR de extras y CD con BSO. Caja contenedora tamaño A4. Incluye Digipack especial (transparente), Libro A4 de 100 pág. Libro A4 de 28 pág. Del estreno en cines. 4 postales exclusivas. Bolsa de tela. Pulsera. Diseño de portada para el CD. Edición coleccionista limitada  y numerada Nº 902/1000. Edición 2018;
Your Name;Blu-Ray/Blu-Ray + CD;Digipack Coleccionista;3;Makoto Shinkai;2016;Animación. Drama. Romance. Fantástico;Selecta Visión. CoMix Wave Films;
Your Name;Blu-Ray/Blu-Ray + CD;Salón del manga Coleccionista;3;Makoto Shinkai;2016;Animación. Drama. Romance. Fantástico;Selecta Visión. CoMix Wave Films;
Ghost in the Shell 2: Innocence;Blu-Ray/DVD + DVD;Digipack Coleccionista;3;Mamoru Oshii;2004;Animación. Ciencia ficción. Acción. Fantástico;Selecta Visión. Production I.G. 20th Century Fox. Pelicula en DVD y BR. Incluye DVD con music video anthology. Incluye libreto de 32 páginas.;
Ghost in the Shell 2: Innocence;Blu-Ray/DVD;Coleccionista;2;Mamoru Oshii;2004;Animación. Ciencia ficción. Acción. Fantástico;Selecta Visión. Production I.G. Distribuido por Sony. Ed. Coleccionista con amaray azul pelicula en DVD y BR, funda de cartón. Incluye libreto de 24 páginas. Ed. 2012;
Millennium Actress;DVD;Coleccionistas;2;Satoshi Kon;2001;Animación. Fantástico. Romance. Drama;Selecta Visión.  Pelicula en DVD y DVD de extras. Digipack dentro de caja con tapa. 2 postales e ilustración firmada por Satoshi Kon (0049/1499). Libro 95 pág. Sitges 2001. Edición limitada 1125-1499. Edición 2006;
Super Dimension Century Orguss 02;DVD;Sencilla;1;Fumihiko Takayama;1993;Animación. Ciencia ficción. Acción. Aventuras | Robots;Selecta Visión. Manga. J.C. Staff. Serie de 6 Ovas. Serie completa. Ed. 2004;
Vexille;DVD;Sencilla;2;Fumihiko Sori;2007;Animación. Ciencia ficción | Cyberpunk;Aurum Produciones. Edición especial 2 discos;
Appleseed;DVD;Sencilla;1;Kazuyoshi Katayama;1988;Animación. Ciencia ficción. Acción | Robots. Crimen;Selecta Visión. Manga. Bandai Visual. Distribuido por Walt Disney. Ed. 2003;
Men in Black International;Blu-Ray;Steelbook;2;F. Gary Gray;2019;Ciencia ficción. Acción. Comedia | Extraterrestres.;Sony. Columbia Pictures. Amblin Entertainment. Incluye BR de extras. Edición Steelbook con Pawny en portada.;
Vanilla Sky;Blu-Ray;Sencilla;1;Cameron Crowe;2001;Drama. Intriga. Thriller. Romance | Remake;Paramount. Distribuido por Sony Pictures. CW Productions. Edición 2019. Tom Cruise, Cameron Diaz, Penélope Cruz.;Caja 3, debajo cama (1)
