Titulo;Formato;Edicion;discos;Director;Year;Genero;Observaciones;Localizacion
Música, maestro;DVD;Sencilla;1;Jack Kinney, Clyde Geronimi, Hamilton Luske;1946;Animación. Musical. Infantil | Película de episodios;Walt Disney Productions. Clásicos de Walt Disney. Nº 8. Edición Inglesa. (Make Mine Music) No editada en España. Slip Cover. Edición 2014;
Los Tres Caballeros;DVD;Sencilla;1;Norman Ferguson;1944;Animación. Infantil. Comedia. Musical | Película de episodios.;Walt Disney Productions. Buena Vista Home Entertainment. Clásicos de Walt Disney. Nº 7 en España. Español Latinoamericano. Punto blanco. USA;
Saludos Amigos;DVD;Sencilla;1;Wilfred Jackson, Jack Kinney, Hamilton Luske;1942;Animación. Comedia. Musical. Infantil;Walt Disney Pictures. Buena Vista Home Entertainment. Clásicos de Walt Disney. Nº 6 en España. Español Latinoamericano. Punto negro. USA;
Atlantis: El imperio perdido;Blu-Ray;Sencilla;1;Gary Trousdale, Kirk Wise;2001;Animación. Aventuras. Fantástico | Steampunk;Toon City. Walt Disney Feature Animation. Walt Disney Pictures. Clásicos Nº 41 en España. Incluye Audio Catalán. USA. Ed. 2014;
El emperador y sus Locuras;Blu-Ray;Sencilla;1;Mark Dindal;2000;Animación. Infantil. Comedia. Fantástico;Walt Disney Pictures. Clásicos de Walt Disney. Nº 40 en España. Incluye Audio Catalán. Edición 2014. USA;
Dinosaurio;Blu-Ray;Sencilla;1;Eric Leighton, Ralph Zondag;2000;Animación. Aventuras. Infantil | Dinosaurios. Prehistoria;Walt Disney Pictures. Distribuida por Buena Vista Home Enterainment (TWDCI, S.L.) Clásicos de Walt Disney. Nº 39 en España. USA;
Dead Rising: Watchtower;Blu-Ray;Sencilla;1;Zach Lipovsky;2015;Terror. Ciencia ficción | Zombis. Videojuego;Content Film. Legendary Digital Media. Crackle. Contradiction Films. Luk International. Distribuido por TEMA distribuciones;
La Princesa Prometida;Blu-Ray;Sencilla;1;Rob Reiner;1987;Aventuras. Romance. Comedia. Fantástico;Metro-Goldwyn-Mayer.  Act III Productions. Buttercup Films Ltd. Distribuida por 20th Century Fox. Amary azul reciclable. Musica Mark Knopfler;
El Chef la receta de la Felicidad;Blu-Ray;Sencilla;1;Daniel Cohen;2012;Comedia | Cocina;A ContraCorriente Films. Coproducción Francia-España. Gaumont. Canal+. Incluye audio catalán.;
Memories;DVD;Sencilla;1;Katsuhiro ?tomo;1995;Animación. Ciencia ficción. Bélico. Aventuras | Película de episodios;TriStar. Distribuido por Columbia TrisTar Home Entertaiment. Disco rojo. 2004. Guión: Satoshi Kon (Historias: Katsuhiro ?tomo). Rosa Magnética, Bomba Fétida y Carne de Cañón;
Cal;DVD;Sencilla;1;Pat O'Connor;1984;Drama. Romance | IRA. Terrorismo;Manga Films. Warner Bros. Pictures. Musica Mark Knopfler;
Parásitos;Blu-Ray;Amaray Negro;1;Bong Joon-ho;2019;Intriga. Comedia. Drama. Thriller;Cameo. La Aventura. Corea del Sur. Barunson. CJ Entertainment. TMS Comics. Incluye folleto interior y slip cover exclusiva de Planet Ocio;
El padrino;Blu-Ray;Legado Corleone;1;Francis Ford Coppola;1972;Drama | Mafia. Crimen. Años 40. Años 50. Familia.;Edición Legado Corleone. Pack con la Trilogía. Distribuido por Sony Pictures. Paramount Pictures. Alfran Productions;
El padrino. Parte II;Blu-Ray;Legado Corleone;1;Francis Ford Coppola;1974;Drama | Mafia. Crimen. Familia. Años 1910-1919.;Edición Legado Corleone. Pack con la Trilogía. Distribuido por Sony Pictures. Coppola Co. Production. (Paramount Pictures);
El Padrino. Parte III;Blu-Ray;Legado Corleone;1;Francis Ford Coppola;1990;Drama | Mafia. Crimen. Familia. Años 70. Secuela;Edición Legado Corleone. Pack con la Trilogía. Distribuido por Sony Pictures. Paramount Pictures;
El Padrino. Contenido Adicional;Blu-Ray;Legado Corleone;1;;1990;;Edición Legado Corleone. Pack con la Trilogía. BR de Extras con making of, escenas adicionales, La música de El Padrino, etc. El pack incluye el Arbol de la familia Corleone y marco con foto-postales.;
Pacifico Sur;Blu-Ray;Digipack;3;Mark Brownlow, Chiara Bellati, Jonathan Clay;2009;Serie de TV. Documental | Miniserie de TV. Documental marino;South Pacific (Wild Pacific). Emmon. Coproducción Reino Unido-Estados Unidos. BBC. Discovery Channel. SAVOR;
Dragones y mazmorras;DVD;Digipack;4;Kevin Paul Coates, Mark Evanier;1983;Serie de TV. Animación. Aventuras. Fantástico ;3 temporadas. 28 episodios. Ref. TS398. Edición Limitada y Numerada 1600 Ejemplares (1886). Incluye 8 postales. Español Neutro. Todas las Zonas 1-6;
HammerBoy;DVD;Sencilla;1;Ahn Tae-geun;2003;Animación. Acción. Aventuras. Ciencia ficció;Filmax Home Video. Character Plan. Corea del Sur;
Mentiras Arriesgadas;Blu-Ray;Amaray Rojo;1;James Cameron;1994;Acción. Comedia | Espionaje. Remake;Ref. TS548. 20th Century Fox. Lightstorm Entertainment. Productor: James Cameron.;Caja 1, debajo cama (2)
Bailando con Lobos;Blu-Ray;Sencilla;2;Kevin Costner;1990;Aventuras. Western. Drama | Cine épico;Ref. TS508. Orion Pictures / Tig Productions;Caja 1, debajo cama (2)
DragonHeart;Blu-Ray/DVD;Sencilla;1;Rob Cohen;1996;Fantástico. Aventuras | Fantasía medieval.;Universal Pictures;
U-571;Blu-Ray;Sencilla;1;Jonathan Mostow;2000;Bélico. Intriga | II Guerra Mundial. Submarinos;Ref. TS Universal Pictures;Caja 1, debajo cama (2)
Las Aventuras de Ford Fairlane;Blu-Ray;Sencilla;1;Renny Harlin;1990;Acción. Comedia | Música. Policíaco. Comedia absurda;20th Century Fox / Silver Pictures. Ref. Ts459;Caja 1, debajo cama (2)
Robotech: The Shadow Chronicles;Blu-Ray;Sencilla;1;Dong-Wook Lee, Tommy Yune;2006;Animación. Ciencia ficción | Robots. Secuela;Harmony Gold;
Unidad de Élite;Blu-Ray;Sencilla;1;Jessy Terrero;2012;Acción. Drama | Crimen;Divisa. Inopia Films. Divisa red. Grindstone. Cheetah Vision. Emmett. Furla Films;Caja 2, debajo cama (2)
Yo, El Halcón;Blu-Ray;Sencilla;1;Menahem Golan;1987;Acción. Drama | Deporte. Familia;Cannon Group / Golan-Globus Productions / Warner Bros. Sylvester Stallone;
Cobra;Blu-Ray;Sencilla;1;George Pan Cosmatos;1986;Acción | Asesinos en serie. Policíaco;Warner Bros. Sylvester Stallone;
Sabotage;Blu-Ray/DVD;Sencilla;2;David Ayer;2014;Thriller. Acción | Drogas;Divisa. Inopia Films. Open Road Films / Qed International. Arnold Schwarzenegger. Edición BR/DVD;
Hotel Rwanda;Blu-Ray/DVD;Sencilla;2;Terry George;2004;Drama | África. Basado en hechos reales. Años 90;"Divisa. Beta. Kino Classics. Coproducción Reino Unido-Canadá-Sudáfrica-Italia; Lionsgate, United Artists. Edición BR/DVD";
Copito de Nieve;Blu-Ray/DVD;Sencilla;2;Andrés G. Schaer;2011;Animación. Infantil. Aventuras | Animales.;Divisa. Filmax Home Video. Utopía Global, Muf Animation, Producions A Fonsagrada. Edición BR/DVD. Audio catalán.;
La Lista de Schindler;Blu-Ray;Sencilla;2;Steven Spielberg;1993;Drama | Nazismo. Holocausto. Basado en hechos reales;Universal Pictures / Amblin Entertainment. Distribuido por Sony Pictures. Liam Neeson. Incluye Blu-Ray de Extras.;
La cosa (El enigma de otro mundo;Blu-Ray;Sencilla;1;John Carpenter;1982;Ciencia ficción. Terror. Fantástico | Extraterrestres.;Universal Pictures. Turman-Foster Company. Distribuido por Sony. Incluye las dos peliculas la de 1982 y la de 2011 en 2 BR;
La cosa (The Thing);Blu-Ray;Sencilla;1;Matthijs van Heijningen Jr.;2011;Ciencia ficción. Terror. Intriga. Thriller | Precuela.;"Coproducción Estados Unidos-Canadá; Strike Entertainment. Universal Pictures. Distribuido por Sony. Incluye las dos peliculas la de 1982 y la de 2011 en 2 BR";
Guardianes de la Galaxia Vol. 2;Blu-Ray 3D;Sencilla;2;James Gunn;2017;Ciencia ficción. Aventuras. Acción. Comedia | Aventura espacial.;Marvel Studios / Walt Disney Pictures. Incluye BR 3D con la pelicula;
Ant-Man;Blu-Ray 3D;Sencilla;2;Peyton Reed;2015;Ciencia ficción. Fantástico. Acción. Comedia | Robos & Atracos. Insectos.;Marvel Studios / Gary Sanchez Productions / Walt Disney Pictures. Incluye BR 3D con la pelicula;
Capitán América El Soldado de Invierno;Blu-Ray 3D;Sencilla;2;Anthony Russo, Joe Russo;2014;Acción. Thriller | Espionaje. Superhéroes. Cómic.;Marvel Entertainment. Marvel Studios. Distribuido por Walt Disney Company Iberia, S.L. Incluye BR 3D con la pelicula;
Coco;Blu-Ray;Steelbook;2;Lee Unkrich, Adrián Molina;2017;Animación. Fantástico. Comedia. Drama;Pixar Animation Studios / Walt Disney Pictures;
El Rey Léon;Blu-Ray 3D;Steelbook;2;Jon Favreau;2019;Animación. Aventuras. Drama. Musical | Animales.;Walt Disney Pictures / Fairview Entertainment;
xXx: Reactivated;Blu-Ray;Steelbook;1;D.J. Caruso;2017;Acción. Aventuras. Thriller | Secuela;Revolution Studios / Huahua Media / Maple Cage Productions;
El Increíble Hulk;DVD;Steelbook;2;Louis Leterrier;2008;Fantástico. Acción. Ciencia ficción | Cómic.;Universal Pictures / Marvel Entertainment / Marvel Studios ;
Nostalgia;DVD;Steelbook;2;Andrei Tarkovsky;1983;Drama | Drama psicológico;"Coproducción Italia-Unión Soviética (URSS); Opera Film Produzione / Rai Due";
Detective Conan 5: Cuenta regresiva al cielo;DVD;Pack DVD Sencillo;1;Kenji Kodama;2001;Animación. Intriga. Comedia | Manga. Crimen;TMS Entertainment;
Detective Conan 6: El fantasma de la calle Baker;DVD;Pack DVD Sencillo;1;Kenji Kodama, Shouji Takizawa;2002;Animación. Intriga. Comedia | Sherlock Holmes.;TMS Entertainment;
Detective Conan 13: El perseguidor negro;DVD;Pack DVD Sencillo;1;Yasuichiro Yamamoto;2009;Animación. Intriga. Comedia | Crimen. Manga;NTV;
Detective Conan 14: El barco perdido en el cielo;DVD;Pack DVD Sencillo;1;Yasuichiro Yamamoto;2010;Animación. Intriga. Comedia | Crimen. Manga;Tokyo Movie;
Detective Conan 15: Quarter of Silence;DVD;Pack DVD Sencillo;1;Yasuichiro Yamamoto, Seino Anabun;2011;Animación. Intriga. Aventuras | Manga;Tokyo Movie;
El detectiu Conan: Episodi 1.El detectiu que es va encongir;DVD;Pack DVD Sencillo;1;Yamamoto, Yasuichirô;2016;;;
Detective Conan 16: The Eleventh Striker;DVD;Pack DVD Sencillo;1;Kobun Shizuno;2012;Animación. Intriga | Manga. Deporte;Tokyo Movie;
Detective Conan 17: Private Eye in the Distant Sea;DVD;Pack DVD Sencillo;1;Kobun Shizuno;2013;Animación. Intriga | Manga;TMS Entertainment / V1 Studio;
Detective Conan 18: Sniper From Another Dimension;DVD;Pack DVD Sencillo;1;Kobun Shizuno;2014;Animación. Intriga. Aventuras. Comedia;Shogakukan-Shueisha Productions / Yomiuri TV. Toho;
Detective Conan 19: Los girasoles del fuego infernal;DVD;Pack DVD Sencillo;1;Kobun Shizuno;2015;Animación. Intriga. Drama. Comedia;Tokyo Movie Shinsha (TMS);
Detective Conan 20: The Darkest Nightmare;DVD;Pack DVD Sencillo;1;Kobun Shizuno;2016;Animación. Intriga. Comedia | Crimen;TMS Entertainment / V1 Studio (20);
Detective Conan 21: The Crimson Love Letter;DVD;Pack DVD Sencillo;1;Kobun Shizuno;2017;Animación. Acción. Aventuras. Intriga | Manga;Nippon TV / Toho / Shogakukan-Shueisha Productions;
LA DESAPARICIÓN DE CONAN EDOGAWA. LOS DOS PEORES DÍAS DE LA HISTORIA;DVD;Pack DVD Sencillo;1;Yasuichirô Yamamoto;2014;;;
Sabotaje;Blu-Ray;La casa de Hitchock;1;Alfred Hitchcock;1942;Intriga;;
La Sombra de una Duda;Blu-Ray;La casa de Hitchock;1;Alfred Hitchcock;1943;Cine negro. Intriga. Thriller;;
La Soga;Blu-Ray;La casa de Hitchock;1;Alfred Hitchcock;1948;Intriga | Crimen. Basado en hechos reales;Warner Bros. Pictures / Transatlantic Pictures;
La Ventana Indiscreta;Blu-Ray;La casa de Hitchock;1;Alfred Hitchcock;1954;Intriga | Espionaje. Película de culto;Paramount Pictures;
Pero...¿Quién Mató a Harry?;Blu-Ray;La casa de Hitchock;1;Alfred Hitchcock;1955;Intriga | Comedia negra;Paramount Pictures;
El Hombre que sabía Demasiado;Blu-Ray;La casa de Hitchock;1;Alfred Hitchcock;1956;Intriga | Espionaje. Secuestros. Remake;Paramount Pictures;
Vértigo;Blu-Ray;La casa de Hitchock;1;Alfred Hitchcock;1958;Intriga | Drama psicológico. Thriller psicológico;Vértigo (De entre los muertos) Paramount Pictures / Alfred J. Hitchcock Productions;
Psicosis;Blu-Ray;La casa de Hitchock;1;Alfred Hitchcock;1960;Terror. Intriga. Thriller | Película de culto.;Paramount Pictures;
Los Pájaros;Blu-Ray;La casa de Hitchock;1;Alfred Hitchcock;1963;Terror | Animales. Aves/Pájaros;Universal Pictures. Productor: Alfred Hitchcock;
Marnie, La Ladrona;Blu-Ray;La casa de Hitchock;1;Alfred Hitchcock;1964;Intriga. Drama | Robos & Atracos;Universal Pictures;
Cortina Rasgada;Blu-Ray;La casa de Hitchock;1;Alfred Hitchcock;1966;Intriga | Espionaje. Guerra Fría;Universal Pictures;
Topaz;Blu-Ray;La casa de Hitchock;1;Alfred Hitchcock;1969;Intriga | Espionaje. Guerra Fría;Universal Pictures;
Frenesí;Blu-Ray;La casa de Hitchock;1;Alfred Hitchcock;1972;Intriga | Asesinos en serie;Universal Pictures;
La Trama;Blu-Ray;La casa de Hitchock;1;Alfred Hitchcock;1976;Intriga;Universal Pictures;
El castillo Ambulante;Blu-Ray;Amaray Negro;1;Hayao Miyazaki;2004;Animación. Fantástico. Aventuras. Romance ;Productor: Hayao Miyazaki. Studio Ghibli;
El sexto día;Blu-Ray;Sencilla;1;Roger Spottiswoode;2000;Ciencia ficción. Acción. Thriller | Cyberpunk;Columbia Pictures. Arnold Schwarzenegger;
Roman J. Israel, Esq.;Blu-Ray;Sencilla;1;Dan Gilroy;2017;Drama | Crimen. Drama judicial;Distribuida por Sony Pictures Entertainment (SPE). Cross Creek Pictures. Denzel Washington;
Pitch Black;Blu-Ray;Sencilla;1;David Twohy;2000;Ciencia ficción. Terror | Extraterrestres;Polygram Filmed Entertainment, Interscope Communications;
Las cronicas de Riddick;Blu-Ray;Sencilla;1;David Twohy;2004;Ciencia ficción. Acción | Extraterrestres. Secuela;Universal Pictures, Radar Pictures, One Race Productions,;
Riddick;Blu-Ray;Sencilla;1;David Twohy;2013;Ciencia ficción. Acción | Supervivencia. Monstruos.;Universal Pictures, One Race Productions;
El coleccionista de Huesos;Blu-Ray;Sencilla;1;Phillip Noyce;1999;Intriga. Thriller | Asesinos en serie. Policíaco.;Universal Pictures, Columbia Pictures. Denzel Washington;
La Tapadera;Blu-Ray;Sencilla;1;Sydney Pollack;1993;Intriga. Drama | Drama judicial;Paramount Pictures, Davis Entertainment. Tom Cruise ;
Meru: odisea en el Himalaya;Blu-Ray;Sencilla;1;Jimmy Chin, Elizabeth Chai Vasarhelyi;2015;Documental | Alpinismo / escalada;Coproducción Estados Unidos-India;
Bambi;Blu-Ray;Sencilla;1;David Hand;1942;Animación. Drama. Infantil | Naturaleza.;Walt Disney Productions. Clásicos de Walt Disney. Nº 5 en España Nacionalidad USA. ;
Dumbo;Blu-Ray;Sencilla;1;Ben Sharpsteen;1941;Animación. Musical. Comedia. Infantil | Circo.;Walt Disney Productions. Clásicos de Walt Disney. Nº 4 en España. 70 Aniversario. Edición 2018;
Fantasía;Blu-Ray;Sencilla;1;VV.AA.;1940;Animación. Musical. Fantástico. Infantil | Música.;Walt Disney Productions. Fantasía el clásico original. Clásicos de Walt Disney. Nº 3 en España. Nacionalidad USA;
Pinocho;Blu-Ray;Sencilla;1;Ben Sharpsteen, Hamilton Luske;1940;Animación. Fantástico. Infantil. Drama. Musical ;Walt Disney Productions. Clásicos de Walt Disney. Nº 2 en España. Nacionalidad USA. Edición 2018 /2013;
Blancanieves y los siete enanitos;Blu-Ray;Sencilla;1;David Hand;1937;Animación. Fantástico. Musical. Infantil | Celos;Walt Disney Productions. Clásicos de Walt Disney. Nº 1 en España. Nacionalidad USA. Edición 2018 /2014;
La Sirenita;Blu-Ray;Sencilla;1;John Musker, Ron Clements;1989;Animación. Fantástico. Musical. Infantil | Mitología.;Walt Disney Pictures. Edición Diamante. Clásicos de Walt Disney. Nº 28 en España. Nacionalidad USA. Edición 2013;
Los Aristogatos;Blu-Ray;Sencilla;1;Wolfgang Reitherman;1970;Animación. Musical. Infantil | Gatos. Jazz. Años 1910-1919.;Walt Disney. Edición Especial. Clásicos de Walt Disney. Nº 20 en España. Nacionalidad USA. Edición 2018 / 2012;
El Libro de la Selva;Blu-Ray;Sencilla;1;Wolfgang Reitherman;1967;Animación. Aventuras. Musical. Comedia. Infantil;Walt Disney Productions. Clásicos de Walt Disney. Nº 19 en España. Nacionalidad USA. Edición 2013;
101 Dálmatas;Blu-Ray;Sencilla;1;Wolfgang Reitherman, Clyde Geronimi, Hamilton Luske;1961;Animación. Aventuras. Infantil | Animales. Perros/Lobos;Walt Disney Productions. Clásicos de Walt Disney. Nº 17 en España. Nacionalidad USA. Edición 2012;
La Dama y el Vagabundo;Blu-Ray;Sencilla;1;Clyde Geronimi, Hamilton Luske, Wilfred Jackson;1955;Animación. Infantil | Perros/Lobos;Walt Disney Productions. Clásicos de Walt Disney. Nº 15 en España. Nacionalidad USA. Edición 2011;
Fantasía 2000;Blu-Ray;Sencilla;1;VV.AA.;1999;Animación. Musical. Fantástico. Infantil | Mickey Mouse. Pato Donald.;Walt Disney Feature Animation. Walt Disney Pictures. Clásicos de Walt Disney. Nº 38 en España. Nacionalidad USA.;
Tarzan;Blu-Ray;Sencilla;1;Kevin Lima, Chris Buck;1999;Animación. Aventuras. Drama | África. Naturaleza. Simios. Animales;Walt Disney Pictures. Edgar Rice Burroughs Inc. Clásicos de Walt Disney. Nº 37 en España. Nacionalidad USA. 2012;
Mulan;Blu-Ray;Sencilla;1;Barry Cook, Tony Bancroft;1998;Animación. Aventuras. Acción. Comedia. Musical;Walt Disney Pictures. Clásicos de Walt Disney. Nº 36 en España. Nacionalidad USA. 2013;
El Rey Léon;Blu-Ray;Sencilla;1;Rob Minkoff, Roger Allers;1994;Animación. Drama. Aventuras. Comedia.;Walt Disney Pictures. Clásicos de Walt Disney. Nº 32 en España. Nacionalidad USA. 2011 / 2015. Incluye Slip-cover brillante;
Aladdin;Blu-Ray;Sencilla;1;John Musker, Ron Clements;1992;Animación. Fantástico. Musical. Infantil. Aventuras;Walt Disney Pictures / Walt Disney Feature Animation. Clásicos de Walt Disney. Nº 31 en España. Nacionalidad USA. 2013;
Kubo y las dos Cuerdas Mágicas;Blu-Ray;Sencilla;1;Travis Knight;2016;Animación. Fantástico. Aventuras | Stop Motion. Japón feudal.;Laika Entertainment. Productor: Travis Knight.  Focus Features. Editado internacionalmente por Universal Pictures.;
Cuentos de Terramar;DVD;Steelbook;2;Goro Miyazaki;2016;Animación. Fantástico. Aventuras | Fantasía medieval. Dragones.;Studio Ghibli. Buena Vista Home Entertainment. Nibariki. Aurum Producciones. Incluye DVD de extras.;
King of Thorn: El rey del espino;Blu-Ray/DVD;Sencilla;2;Kazuyoshi Katayama;2009;Animación. Ciencia ficción | Futuro postapocalíptico. Monstruos.;Selecta Visión. Sunrise, Inc.;
El Viento Se Levanta;Blu-Ray;Sencilla;1;Hayao Miyazaki;2013;Animación. Drama | Biográfico. Aviones. Años 20. Años 30.;Studio Ghibli. Vértigo Films. Wild bunch. Distribuido por Sony Pictures. 5 min de extras. Edición amaray azúl. (BD50);
El recuerdo de Marnie;Blu-Ray;Sencilla;1;Hiromasa Yonebayashi;2014;Animación. Drama. Fantástico | Amistad. Adolescencia. Vida rural;Studio Ghibli. Vértigo Films. Wild bunch. Distribuido por Sony Pictures. 9 min de extras. Edición amaray azúl. (BD50);
El Cuento de la Princesa Kaguya;Blu-Ray;Sencilla;1;Isao Takahata;2013;Animación. Fantástico. Drama | Cuentos. Siglo IX;Studio Ghibli. Vértigo Films. Wild bunch. Distribuido por Sony Pictures. Edición amaray azúl y caratula azúl. Más de 2 horas de contenido extra (BD50);
Isla de Perros;Blu-Ray;Sencilla;1;Wes Anderson;2018;Animación. Fantástico. Comedia. Aventuras | Stop Motion.;"Coproducción Estados Unidos-Alemania; American Empirical Pictures. 20th Century Fox (Isle of Dogs)";
FireWorks;Blu-Ray;Sencilla;1;Akiyuki Shinbo, Nobuyuki Takeuchi;2017;Animación. Romance. Fantástico | Adolescencia;Selecta Visión. TOHO. 20th Century Fox. Incluye postal exclusiva. Festival Interancional de Cine San Sebastian 2017;
Perfect Blue;Blu-Ray/DVD;Sencilla;2;Satoshi Kon;1997;Animación. Terror. Thriller. Drama | Drama psicológico.;Selecta Visión. Rex Entertainment. Mad House. 20th Century Fox. Edición 2016;
Nicky, la aprendiz de bruja;Blu-Ray;Sencilla;1;Takashi Shimizu;2014;Fantástico. Aventuras | Brujería. Remake;M3 (Mediatres estudio) Winds of Asia. Being, D.N. Dream Partners, EDKO Film, Kadokawa. Incluye doblaje catalán;
Pompoko;DVD;Sencilla;1;Isao Takahata;1994;Animación. Fantástico. Comedia. Drama;Productor: Hayao Miyazaki. Studio Ghibli. Aurum Producciones.;
Recuerdos del Ayer;DVD;Sencilla;1;Isao Takahata;1991;Animación. Drama. Romance | Infancia. Familia.;Productor: Hayao Miyazaki. Studio Ghibli. Aurum Producciones.;
Spirit, el corcel indomable;Blu-Ray;Sencilla;1;Kelly Asbury, Lorna Cook;2002;Animación. Aventuras. Infantil. Western | Animales. Caballos;DreamWorks Animation. DreamWorks. 20th Century Fox Entertainment. Edición Alemana con audio en castellano.;
Gru, mi villano favorito;Blu-Ray;Pack Amaray gordo;1;Pierre Coffin, Chris Renaud;2010;Animación. Comedia. Ciencia ficción. Infantil;Illumination Entertainment / Universal Pictures Pack con las tres peliculas de Gru y Los minions. Incluye doblaje catalán;
Gru 2, mi villano favorito;Blu-Ray;Pack Amaray gordo;1;Pierre Coffin, Chris Renaud;2013;Animación. Comedia. Ciencia ficción. Infantil;Illumination Entertainment / Universal Pictures Pack con las tres peliculas de Gru y Los minions. Incluye doblaje catalán;
Gru 3, mi villano favorito;Blu-Ray;Pack Amaray gordo;1;Kyle Balda, Pierre Coffin, Eric Guillon;2017;Animación. Comedia. Ciencia ficción. Infantil;Illumination Entertainment / Universal Pictures Pack con las tres peliculas de Gru y Los minions. Incluye doblaje catalán;
Los Minions;Blu-Ray;Pack Amaray gordo;1;Kyle Balda, Pierre Coffin;2015;Animación. Comedia | 3-D. Cine familiar.;Illumination Entertainment / Universal Pictures Pack con las tres peliculas de Gru y Los minions. Incluye doblaje catalán;
Shrek;Blu-Ray;Pack Cartón 4 Amaray's;1;Andrew Adamson, Vicky Jenson;2001;Animación. Comedia. Fantástico. Aventuras | Parodia. Cuentos.;DreamWorks Animation. DreamWorks SKG. Pacific Data Images. 20th Century Fox. Edición 2014. Amaray reciclable. Pack con las 4 peliculas;
Shrek 2;Blu-Ray;Pack Cartón 4 Amaray's;1;Andrew Adamson, Kelly Asbury, Conrad Vernon;2004;Animación. Comedia. Fantástico | Parodia. Cuentos. Fantasía medieval.;DreamWorks Animation. DreamWorks SKG. Pacific Data Images. 20th Century Fox. Edición 2014. Amaray reciclable. Pack con las 4 peliculas;
Shrek Tercero;Blu-Ray;Pack Cartón 4 Amaray's;1;Chris Miller, Raman Hui;2007;Animación. Comedia. Fantástico. Aventuras | Parodia.;DreamWorks Animation. Pacific Data Images (PDI). 20th Century Fox. Edición 2014. Amaray reciclable. Pack con las 4 peliculas;
Shrek, felices para siempre;Blu-Ray;Pack Cartón 4 Amaray's;1;Mike Mitchell;2010;Animación. Comedia. Fantástico. Aventuras | Parodia.;(Capitulo Final) DreamWorks Animation. Pacific Data Images (PDI). 20th Century Fox. Edición 2014. Amaray reciclable. Pack con las 4 peliculas;
BattleShip;Blu-Ray;Sencilla;1;Peter Berg;2012;Ciencia ficción. Acción. Bélico | Aventuras marinas;Universal Pictures. Film 44. Hasbro. Bluegrass Films. Distribuido por Paramount Spain. Incluye audio Catalán.;
Pacific Rim;Blu-Ray;Sencilla;2;Guillermo del Toro;2013;Ciencia ficción. Acción | Robots. Monstruos. Extraterrestres;Warner Bros., Legendary Pictures. Inclute BR de extras con horas de contenido. Amaray Reciclable. Santiago Segura;
Horizonte Final;Blu-Ray;Especial;1;Paul W.S. Anderson;1997;Ciencia ficción. Terror | Aventura espacial;Paramount Pictures. Distribuida por Paramount home Entertainment (Spain). Edición Especial Coleccionista. ;
Infiltrados;Blu-Ray;Sencilla;1;Martin Scorsese;2006;Thriller. Drama. Acción | Mafia. Remake. Crimen. Policíaco;Distribuida por Warner Bros.. Warner Bros., Plan B Entertainment, IEG Virtual Studios. Media Asia Films. Vertigo.  Amaray Reciclable;
Le Llamaban Jeeg Robot;Blu-Ray;Sencilla;1;Gabriele Mainetti;2015;Thriller. Drama. Fantástico | Superhéroes. Mafia;Selecta Visión. 20th Century Fox. Goon Films, RAI Cinema, Ministero per i Beni e le Attività Culturali. Edición 2017;
Invasión a la Tierra;Blu-Ray;Sencilla;1;Jonathan Liebesman;2011;Ciencia ficción. Acción | Extraterrestres. Ejército;Columbia Pictures. Original Film. Distribuida por Sony Pictures Home Entertainment;
Guerra Mundial Z;Blu-Ray;Sencilla;1;Marc Forster;2013;Acción. Ciencia ficción. Thriller. Terror | Pandemias. Zombis;Paramount Pictures, Skydance Productions. GK Films. Plan B Entertainment,;
El quinto elemento;Blu-Ray;Sencilla;1;Luc Besson;1997;Ciencia ficción. Acción | Cyberpunk. Película de culto;Divisa. Gaumont, Columbia Pictures, Pinewood Studios. Francia;
La guerra de los mundos;Blu-Ray;Sencilla;1;Steven Spielberg;2005;Ciencia ficción. Acción. Terror | Extraterrestres.;Tom Cruise. DreamWorks SKG, Paramount Pictures, Amblin Entertainment.;
Godzilla;Blu-Ray;Sencilla;1;Roland Emmerich;1998;Ciencia ficción. Fantástico. Acción | Monstruos.;TriStar Pictures, Centropolis Entertainment, Fried Films. Toho. Distribuido por Sony;
Marte (The Martian);Blu-Ray;Sencilla;1;Ridley Scott;2015;Ciencia ficción. Drama;20th Century Fox. Scott Free Productions, TSG Entertainment;
La Gran Revancha;Blu-Ray;Sencilla;1;Peter Segal;2013;Comedia | Deporte. Boxeo. Vejez;Warner Bros. Callahan Filmworks. Gerber Pictures. Amaray reciclable;
Al filo del Mañana;Blu-Ray;Sencilla;1;Doug Liman;2014;Ciencia ficción. Acción | Extraterrestres. Viajes en el tiempo;Tom Cruise. Warner Bros., 3 Arts Entertainment, Viz Media, Village Roadshow. Amaray Reciclable;
Rock of Ages;Blu-Ray;Sencilla;1;Adam Shankman;2012;Musical. Comedia. Drama | Música. Años 80;Tom Cruise. New Line Cinema, Offspring Entertainment, Corner Store Entertainment. Distribuida en España por Warner Bros;
El Último Samurai;Blu-Ray;Sencilla;1;Edward Zwick;2003;Aventuras. Acción. Drama | Japón feudal. Siglo XIX.;Tom Cruise. Warner Bros., The Bedford Falls Company, Cruise-Wagner Productions. Distribuido por Warner Bros;
Oblivion;Blu-Ray;Sencilla;1;Joseph Kosinski;2013;Ciencia ficción. Intriga | Futuro postapocalíptico.;Tom Cruise. Universal Pictures, Chernin Entertainment, Relativity Studios;
